Author,Text,Date,Score
iamjide91,Not at all. Not even close to what I want to be. I guess flipping from one project to the other is a major cause.,2023-11-01 22:05:59,10
Fammie1660,"Lol, I made alot and Lost a lot, learnt alot",2023-11-02 07:31:07,8
Witty-Bit7551,God dammit you got me with this one 🤣,2023-11-02 01:29:20,5
Loud-Swimmer-3468,I actually lost millions so I'm legitimate now that's what I tell the ladies,2023-11-02 05:45:46,3
ConcernFriendly,That waaaaas me totally!  Then I realized I can funkn win no matter and made bags in other places.  Best advice: Get over it and move on to the next.,2023-11-02 17:37:20,3
Superb_Estate7067,🤣🤣🤣,2023-11-01 11:26:41,5
swordluk,buy high sell low never fails,2023-11-02 09:02:33,2
pnerges,I was doing pretty well for a minute or two.,2023-11-02 17:45:16,2
bookworm010101,xrp,2023-11-02 22:57:32,2
SnooCompliments1686,What’s the original content about ? Makes me sad,2023-11-02 23:01:04,2
kennynol,"I made good money four times but only cashed out once. So I have good instincts for picking projects, I just need to learn to pull out.",2023-11-03 20:34:29,2
Marshallaw89,Damn,2023-11-02 02:25:11,1
Sithaun_Meefase,I just fucking died 😂😂😂😂,2023-11-03 01:44:11,1
TJ420Hunt,I am up from 2017 :),2023-11-05 16:42:04,1
gcardano,I feel personally called out lmao,2023-11-05 22:21:47,1
umbra-daemonium,"$10,000 pack of smokes with dogecoin fml",2023-11-14 23:56:06,1
I_like_salads,"Fuck, this hits too close",2023-12-01 03:12:20,1
EarningsPal,When doing nothing wins,2023-11-02 10:26:53,4
apextek,always gave up 3 months ahead of the next run,2023-11-02 14:19:23,2
SuspiciousStable9649,Only up 50% on a little bit because of exactly this.  And that 50%? Was after I stopped thinking about it.,2023-11-03 01:41:21,1
YokeKeto,The lesson to pull out is one many men have yet to learn...,2023-11-04 01:29:34,2
MadManD3vi0us,Goddamn ain't that the truth...,2023-11-04 17:50:09,2
iamjide91,Seems you are the indicator for the bull run. haha,2023-11-04 19:57:09,1
iamjide91,I think that's the best strategy - buy and forget.,2023-11-04 20:10:00,1
