Author,Text,Date,Score
arahaya,so did we win ore lose?,2024-03-05 15:36:16,3
Green-Music2366,It's clearly a case of crabs.,2024-03-05 15:55:41,3
mikeneedsadvice,What is going on?,2024-03-05 16:48:51,3
gustavolm82,63k...,2024-03-05 17:08:33,3
Visara57,This is most likely the correction before we go to 80K,2024-03-05 17:16:43,3
unsane_sandwiches,Jim Creamer ☹️,2024-03-05 17:17:12,3
BuyHandSanitizer,When are yalll buying more,2024-03-05 17:17:29,3
lockettbloom,adding 0.1 coin at this price. 70k by EOW,2024-03-05 17:18:15,3
VaJohn,Thanks for the dip just in time for DCAing.,2024-03-05 17:40:54,3
Samsonite_1604,Hey newbs… don’t panic sell.  Start DCAing and lower your average cost.,2024-03-05 18:58:50,3
Oheson,"Dip just enough for those who don't really know what Bitcoin is to sell to those that do for their debasing trinkets.  Larry Fink would like to thank you for your service.

Remember to report your 30% short term capital gain to Uncle Sam.  Good luck to you trying to buy back lower after Larry's daily purchase is reflected in the market.",2024-03-05 19:01:57,3
R3dFiveStandingBye,TIMBERRR,2024-03-05 19:38:59,3
ToshiSat,"The pi cycle top indicator is still good, we’re still weeks/months from the top. I sleep fine",2024-03-05 19:41:20,3
tesseramous,"Hello group let's share how you all got your anxiety disorder.

*Patient 1: I went to war

*Patient 2: I was addicted to drugs

*Patient 3: I had an abusive father

*Patient 4: I was in a car accident

*Patient 5: I traded crypto for years",2024-03-05 19:45:01,3
goldenprey123,Ight I’m done buying y’all can run it to 100k now,2024-03-05 19:49:05,3
Romsel87,Back to stacking some sats.,2024-03-05 19:58:24,3
stoop911,weed em out,2024-03-05 19:59:58,3
irisuniverse,Holy volatility Batman,2024-03-05 20:04:26,3
bojothedawg,Bitcoin taking a breather before ascending to the next peak. Pacing itself like an experienced mountaineer.,2024-03-05 20:10:52,3
Seeders,[Predictable rejection lmfao](https://www.reddit.com/r/CryptoCurrency/comments/1b5wcwe/daily_crypto_discussion_march_4_2024_gmt0/ktcllm3/),2024-03-05 20:11:37,3
DogoByte,I appreciate the little dip before we take off to the moon. Managed to stack a bit more.,2024-03-05 20:13:06,3
Bonkers119,I should have bought the dip,2024-03-05 20:15:14,3
Silver-Rub-5059,What a shit ATH 😂,2024-03-05 21:01:56,3
el_rico_pavo_real,When can we expect Saylor to execute the convertible note sale to generate the $600M and buy all that corn?,2024-03-05 21:23:40,3
Visara57,People waiting for a bigger dip lost the train. Last chance to buy!,2024-03-05 21:24:31,3
Lonely_Green_1195,"Not entirely sure how etfs work, if the newbs in that space get shook and start selling, is the real corn being sold too?",2024-03-06 00:23:14,3
Cramer4President,"If one only has access to stocks and can't directly invest in bitcoin, any thoughts on the best ticker that would follow it? How about COIN?",2024-03-06 02:33:09,3
Get_the_nak,After a couple of knocka on the door to 64 k we’re now shooting past and aiming for 65k! ,2024-03-06 04:56:42,3
philosophicalpango,See erryone we be okay,2024-03-06 05:01:28,3
Suspicious-Composer8,Here we go again,2024-03-06 05:12:40,3
Ghostserpent,"It’s over. Bitcoin is obviously not hitting all time high when it only has an extremely scarce supply, highest demand of all time, and ETFs that allow institutions to buy billions per day in bitcoin",2024-03-05 18:59:50,8
Get_the_nak,NO SLEEP TIL ATH,2024-03-05 10:52:57,4
Soi_Boi_13,Making another run 🚀,2024-03-05 14:44:33,5
monaarts,Hitting ATH before 10am,2024-03-05 14:51:53,6
philosophicalpango,Aiiiiiiiiiiiiye cmoooooooon,2024-03-05 14:51:57,4
amazingalcoholic,We gonna do it,2024-03-05 14:52:04,5
BTC_Baron,To the mooooooon!,2024-03-05 15:03:03,6
NefariousnessLow2933,I WAS HERE,2024-03-05 15:03:13,4
ManuPro06,YEAHHHHHHHHH,2024-03-05 15:03:28,4
Xpertbasterd,Ladies & Gentlemen... We did it!,2024-03-05 15:03:53,4
cubeeless,Hodl me,2024-03-05 15:05:12,5
cadietp,How can I dive in and roll around in my bitcoins like Scrooge McDuck,2024-03-05 15:07:53,5
radicalEngineer,That doesn’t count as ATH.  No pizza yet,2024-03-05 15:11:33,4
x2manypips,Looks like no one is really selling. This is going to go so much higher,2024-03-05 15:49:52,5
samb0_1, Can't go up in a straight line forever,2024-03-05 16:08:10,5
NectarineDirect936,Coinbase won't even let me buy this dip mf's.. ,2024-03-05 16:21:17,5
Chesterumble,I am just throwing in $100 every time I get an alert that it went down 3%.,2024-03-05 17:20:52,5
BigDeezerrr,Saylor licking his lips at these prices with that new $600 million he's been raising.,2024-03-05 18:44:02,5
DiRienzo3410,Fuckin bitcoin. Pumps us up with an ATH and then crashes. Time to buy more,2024-03-05 19:12:33,5
SAMSON91747,Are you not entertained ?!,2024-03-05 19:24:41,6
jrafelson,ARE YOU NOT ENTERTAINED!!!!!!!!!!!????? 😂😂😂 We are all fucking lunatics around here!!,2024-03-05 20:05:49,5
Powerpuff_Rangers,So who's foolish enough to sell their stash to Blackrock?,2024-03-05 20:21:53,5
Frogolocalypse,Will we ever recover to the heady heights of bitcoin prices seen not seen since ~~two days~~ one day ago?,2024-03-05 23:47:23,5
SpaceToadD,"Today might be the day…
For price discover-raayyyyy",2024-03-05 13:07:23,5
btc_marshmallow_test,"#DON'T YOU KNOW, PUMP IT UP!  
#YOU'VE GOT TO PUMP IT UP!",2024-03-05 14:51:30,7
Aljaho,"If you're new and freaking out about the price dropping... try not to. What you'll see here, any time the price drops a few percent is a special breed of idiot.... One  that likes to crawl out from under their rock and boldly proclaim that it's going to crash to *insert dramatically low price* as though they've just arrived on their time machine back from the future. They're  either 

A- New themselves and have no clue what they're talking about 

B Stirring shit

 or 

C Just plain dumb....   

They magically disappear again whenever the price stabilises/increases.  It's best to ignore them.",2024-03-05 17:28:36,5
[deleted],[deleted],2024-03-05 19:04:09,6
[deleted],[deleted],2024-03-05 19:26:26,5
Micksar,"~ 2% pullback after being up 53% this month and hitting ATH a month before the halving? Stay smart, folks. Don’t let other peoples’ panic bleed into your plan.",2024-03-05 16:56:59,8
bwhough,"I was downvoted last night when I predicted an imminent correction, and here we are. 😅 Reminder that these sorts of corrections are healthy! The world is not ending, the sky is not falling. This is just the market doing what it always does. Yes, ETFs have accelerated the timeline pre-halving - but the fundamentals are what they always have been.",2024-03-05 19:39:47,8
[deleted],[removed],2024-03-05 10:40:47,5
BTC_Baron,"pro-coinbase graphs show a huuuuuuge wall coming up if it hits $69k, like 200BTC.",2024-03-05 14:09:33,5
LiteratureUsual614,ATH✅,2024-03-05 15:02:18,5
LuKeNuKuM,69!,2024-03-05 15:02:54,4
monaarts,New ATH!!!,2024-03-05 15:03:02,4
LeWahooligan0913,BOOM,2024-03-05 15:03:03,5
00DEADBEEF,69,2024-03-05 15:03:36,3
CaptainDr,LETS GOOOOO,2024-03-05 15:03:57,4
wifi_god69,"$69,420 is not a meme!",2024-03-05 15:05:11,4
Yeti_racer,Didn't even wait till 69420...,2024-03-05 15:05:45,4
Worried-Ad-9077,Omg omg stay calm everyone stay calm!,2024-03-05 15:06:31,3
wentzoverdak,STOP SELLING,2024-03-05 15:07:40,3
displaybeats,"He bought?

Dump it",2024-03-05 16:22:53,3
beeqe,"ny exchange closed down, alright guys pump incoming",2024-03-05 21:05:58,4
Eliagbs_,"Bought another $200 the past 24hrs with an average cost of $65,239.16, still have yet to buy at an ATH. Feeling good about every buy",2024-03-05 23:26:35,4
Ok_Art_2874,Bitcoin pumping up again. Will it be at ATH tomorrow - 70k?,2024-03-06 05:43:45,4
Visara57,"I genuinely cannot see BTC going below 60K for this dip. We'll be in 100K in no time, it's actually mind-boggling",2024-03-05 22:00:04,7
Tron_Passant,"Lots of profit taking, which is totally understandable given the run we've been on. Halving is six weeks away. Use this opportunity for what you will.",2024-03-05 17:23:02,5
arBettor,"I took out a payday loan to buy BTC with 100x leverage at 69,069. What do?",2024-03-05 19:58:06,6
DrFore,Everyone relax. Just refilling the fuel before we continue our journey to the moon 🌕,2024-03-05 12:58:28,2
Tahmeed09,"Is it illegal for big players to buy bitcoin from the open market because their large purchase will eat up liquidity? They always do OTC, but if they do market we would moon quick",2024-03-05 13:02:56,2
mage14, PAMPH EITH !!!!,2024-03-05 14:46:07,2
WillTheOnly,Go! Go! Go!,2024-03-05 14:46:53,2
Dynatox,"~~Bears~~ Bulls, beware the ides of March.",2024-03-05 14:47:19,2
btc_marshmallow_test,"LINE GO UP!

LINE GO UP!

LINE GO UP!",2024-03-05 14:55:12,2
UKFAN3108,"Does anyone ever wonder who the individual person was who purchased BTC at the previous ATH. Wonder how they've felt about it over the past few years. Would be an interesting ""claim to fame"" or something along those lines.",2024-03-05 14:57:12,2
Ok_Art_2874,$69k ATH approacheth. It’s a sign of the rise of Lisan al Gaib … or Kwisatz Haderach??,2024-03-05 15:01:39,2
Lostindaether,"Done!

Oops a little premature eja…I mean celebration",2024-03-05 15:02:12,2
btc_marshmallow_test,Within $3,2024-03-05 15:02:41,2
theFoolishEngineer,there she goes,2024-03-05 15:04:05,2
njakrivos,"Oh my god, we did it!!!",2024-03-05 15:04:16,2
electric_trapeezee,!,2024-03-05 15:04:18,2
Its-Phenomenal,price discovery baby!!!!,2024-03-05 15:04:33,2
TexasBoyz-713,"Now, shoot straight to 75k!!",2024-03-05 15:04:39,2
ToshiSat,I was here ! ™️,2024-03-05 15:04:40,2
Philthy91,Look at that wall at 70k lol,2024-03-05 15:04:46,2
LettuceEffective781,"Hey BTC/USD made it above the number!
Now number go up",2024-03-05 15:06:50,2
ToshiSat,The climb is back lol,2024-03-05 15:06:56,2
Gr8fu11,"Just woke on the Wes Coast US, did I miss anything?",2024-03-05 15:07:47,2
FrivolerFridolin,"Well we have a new ATH at around $69,210",2024-03-05 15:10:15,2
Enlighted9,Well... that party didn't last long,2024-03-05 15:35:38,2
RecessionGuy,We go again! Still need to break 69k on Binance,2024-03-05 15:47:59,2
gustavolm82,What a spectacle to watch.,2024-03-05 16:03:24,2
samb0_1,First time getting my btc withdrawal  rejected on binance 🤣,2024-03-05 16:09:56,2
Smooth-Criminal-TCB,Bought $100 on this dip. $65.1k,2024-03-05 16:14:35,2
__Shadowman__,Damn there no bottom... Yet,2024-03-05 16:18:55,2
Yeti_racer,Nice discount,2024-03-05 16:41:48,2
gustavolm82,64k here,2024-03-05 17:06:54,2
Ramdom_c-137,It's all over noobs - Sell up now or hit a big dip - I'll buy your sats,2024-03-05 19:37:58,2
mgd09292007,What do you think it will pull back to?,2024-03-05 19:41:35,2
maxwellhilldawg,SATOSHI HODL THE LINE,2024-03-05 19:44:19,2
gustavolm82,omg 61k,2024-03-05 19:47:06,2
chriskzoo,Who are we liquidating with this dip?,2024-03-05 19:48:29,2
Tahmeed09,"Just saw 59.. god candle, but red? Whats that called?",2024-03-05 19:57:09,2
Visara57,New chance to buy before it goes back up,2024-03-05 19:57:25,2
Dinbs,"The pumpening starts now, we have a ride ahead of us boys",2024-03-05 20:08:17,2
Stearny87,The GBP markets on coinbase advanced are f’ed again. $62.8k should be £49.5k but you can currently buy for £44.6k! If anyone has some funds set aside to buy now’s a great time. It will get back in sync with USD soon,2024-03-05 20:13:56,2
somedudenamedjason,"Ok, I’ll buy some more.",2024-03-05 21:21:21,2
jeriho,"Mood 
https://youtu.be/CIrvSJwwJUE?si=Nztp1673nVFZDWjV",2024-03-05 21:29:42,2
el_rico_pavo_real,"I’m curious to see if we get a report about any large entity liquidating holdings, GBTC, for example; or if it was literally just retail going crazy. Today was nuts lol. I love that we are already back over $64K",2024-03-05 23:47:06,2
ieatvegans,"Woohoo, a new BTC day begins!",2024-03-06 00:00:47,2
p1hk4L,"I know people are holding for life and all that, but what are some of your exit plans to sell some btc for major milestones like a house? 

If btc ever hit like 250-500k I might sell and buy a house. What is even the best way to quickly make a transaction like that? Coinbase would only let me sell/withdraw a certain amount per day from what I rmemeber",2024-03-06 00:05:39,2
x2manypips,Correction’s already over? LOL,2024-03-06 05:12:14,2
Dont_Waver,"How will we ever survive this massive crash down to a price we were happy to hit 1 day ago? Pack it in, Bitcoin is dead.",2024-03-05 21:49:07,11
DogCallCenter,"Never go full FuckYou until the money's in the bank, bruh.",2024-03-05 20:00:04,7
ProfessionalWelcome,Probably a hundred thousand dollars in a day at some point if we make it to 1M,2024-03-05 23:51:20,9
avance70,"the thing is, if they bought at $1, they'd sell it at $5 or $10, so...",2024-03-05 11:03:48,4
Alfador8,New bull run means lots of noobs with tight unlubricated buttholes. ,2024-03-06 02:47:44,4
NikolaiGogol,"This is like picking on the slow kid in class. Have some compassion for the poor guy, man.",2024-03-05 15:27:34,9
ProofCartoonist,Sure you can tell your grandkids : Go sell these and buy yourself a nice spaceship,2024-03-05 16:20:04,5
TexasBoyz-713,That’s the way I see it too. All the 69’s in the world mean nothing unless we actually push past it,2024-03-06 03:40:15,7
el_rico_pavo_real,They don't deserve to ride the ride if they are so quick to sell at such an arbitrary number.,2024-03-05 15:09:19,3
encryptzee,Another $0.5B? GD!,2024-03-05 06:27:14,3
MrKittenz,"The ETFs average 220 million a day of inflows (562 million today)

That’s an average of 3283 btc purchased a day at current price (so it’s actually higher than this)

900 coins a day are mined 

Did I math right cause that’s nuts",2024-03-05 06:38:29,4
Frogolocalypse,Best day yet for Fidelity.,2024-03-05 07:07:54,2
Saddath,"does not matter when previously the rallies have come. This cycle might be different. Everybody and their mother read about the halving and in anticipation of a bullrun started buying. Which in turn started the bullrun earlier than normal...

But that's just my interpretation.",2024-03-05 07:48:30,8
ToshiSat,Perspective is key here,2024-03-05 17:20:10,2
philosophicalpango,You might be high,2024-03-05 20:13:43,2
beeqe,😂 Love it,2024-03-05 20:17:38,2
Coretron,"Na, they said there'd be lambos",2024-03-06 06:34:27,2
DaRealElonMusk,Hitting 70k soon today,2024-03-05 15:06:23,6
todwardscizzorhands,In all honesty who the hell thinks it's not going to go higher than 69k? In wonder why ppl are trying to sell at 69k rn. A sell limit at 75k would b extremely conservative and would be guaranteed in this market.,2024-03-05 16:05:26,7
franciscoanconia,lol,2024-03-05 16:57:26,2
Dinbs,Thanks we needed that safety net,2024-03-05 20:09:15,4
Silver-Rub-5059,Don’t use round numbers for limit orders,2024-03-05 20:10:31,3
[deleted],[deleted],2024-03-05 21:05:04,2
ieatvegans,Turds down the drain.,2024-03-06 00:44:30,5
Frogolocalypse,Brad and Angelina have broken up.,2024-03-05 06:44:37,15
MrKittenz,"Lightning network! It’s so cool. 

I’ll show you how fast you can send 1000 btc",2024-03-05 06:43:29,9
Llonga,Women now have balls,2024-03-05 07:46:11,24
tesseramous,"Online games don't have a server list anymore,  only automated matchmaking lobbies.",2024-03-05 07:34:58,5
Get_the_nak,You now own shitcoins,2024-03-05 13:49:10,3
OldPyjama,There's another war in Europe now.,2024-03-05 08:42:56,4
gustavolm82,to your laptop?,2024-03-05 06:20:36,2
FarResponsibility761,"I was curious too, I saw this morning",2024-03-05 12:57:21,2
heartbleed_hack,"Rounding errors, difference between increase in cash and holdings purchases, etc.  Its not material, just accounting stuff.",2024-03-05 14:12:19,2
irisuniverse,Where do you find this info?,2024-03-05 16:11:36,3
Micksar,Buying up all the bitcoin retail is panic selling.,2024-03-05 16:18:35,3
fCorruption,Round 2.,2024-03-05 15:07:18,3
vnielz,Missing those good old memes,2024-03-05 15:49:06,3
Grizzzlybearzz,Good times,2024-03-05 15:56:55,3
user_name_checks_out,Got to wait for $90K I guess,2024-03-05 16:05:31,2
UrethreaFranklin1,And they will say it’s crashing,2024-03-05 16:26:34,5
cpickle63,[HODL](https://bitcoincoaster.com/about/),2024-03-05 19:41:26,2
Dinbs,It's indicative of a big firm dumping every hour to make sure they can get as much return as possible.,2024-03-05 20:00:33,3
Weatherround97,I mean it went from 68k-61k not exactly 10k,2024-03-05 20:39:05,2
New-Connection-9088,"I think people were way over-leveraged on the longs. It happens with every bull run. Newbies with no trading experience turn the leverage dial much higher than they should, and they keep the position open far longer than they should. They take no profit on the way up, then lose the entire position on the way down. Today is just a normal day in BTC.",2024-03-05 21:14:37,3
bojothedawg,"Could be soon given the chairman's comments that they are considering ""recalibrating supply dynamics in response to unforeseen market liquidity requirements"".

Rumour has it that at tomorrow's board meeting they may decide to delay the halvening and possibly issue a new batch of coins aimed at meeting the increased demand from ETFs.",2024-03-05 22:41:32,3
ieatvegans,HE CAN'T KEEP GETTING AWAY WITH THIS!!!,2024-03-05 23:41:46,5
Anzu_Yamasaki,tomorrow,2024-03-05 22:12:26,3
Dynatox,It's more fun waking up to it.  What u gonna do when we zoom from 70 to 80k in one day and get the God candle?,2024-03-06 05:32:37,3
Silver-Rub-5059,It’s a marathon but it’s been run at sub 2hr pace lately,2024-03-05 09:01:07,3
NectarineDirect936,"Did already.. back to catching falling knives, my favorite sport.",2024-03-05 17:15:30,2
Romsel87,REKT.,2024-03-05 20:00:25,2
chasecards19,What does that mean?,2024-03-06 05:21:23,2
gustavolm82,yep... they cant handle it...  i said that hours ago when this started after 68 and down and people started to ask if it was going down.. .. it recovered and... bamm  again..  lolll :D,2024-03-05 15:37:10,2
Dont_Waver,...then you win,2024-03-05 21:35:25,7
gustavolm82,"yeah.. its somewhat strange too.. in my country they are literally hidding that it gone down today and publishing about that it hit the ath,  etc etc..
few midia only that coment on and also bring people to coment and mkt bitcoin etc  LIKE NEVER BEFORE!",2024-03-05 22:11:37,3
hateschoolfml,"They complain about the fiat money system everyday but look at you like a crazy person

They will buy at the price they deserve or low time preference humans will replace short time preference ones as we build better without fiat worries",2024-03-05 10:09:52,8
alineali,"The only question is whether this is their conscious choice. Because I could understand it - live your life while young and can really enjoy it, and in 20-30 years you will be living in a different world and you'll decide what to do then. AI alone will be enough to completely change our lives.

IF they do not realize what they are doing and think ""oh, I will save money, just a bit later"" every time - this is a different story.",2024-03-05 10:55:25,3
babojob,"Lol let them sell, some loose, some win",2024-03-05 15:14:18,2
juice06870,Nothing wrong with a quick 69,2024-03-05 15:24:50,9
ByteTraveler,She said that.. hey wait a minute,2024-03-05 15:23:11,5
Primary-Effect-3691,">Who fucking wouldn’t?

Anyone who isn't making 200 grand of a 2k increase in the value of BTC?",2024-03-05 15:43:37,8
Phitzdisco666,"Sorry guys, that was me",2024-03-05 15:44:08,6
Financial_Design_801,"You realize it trades on the worlds biggest capital markets now where all this is transparent 

I mean ya if you wna get destroyed by the irs sure pay that tax bill i guess that 🔮 will help",2024-03-05 15:45:08,3
EyeNTJ,"yeh, my funds have disappeared after several failed orders",2024-03-05 20:30:04,2
ieatvegans,"Better get one more ride in quick, you won't have it long.",2024-03-06 00:49:19,3
somedudenamedjason,That would look good next to [my pig](https://www.reddit.com/media?url=https%3A%2F%2Fi.redd.it%2Fps6b4zwom14b1.jpg).,2024-03-06 02:58:21,2
irisuniverse,Outflow*,2024-03-06 02:34:44,2
HortonHearsaCthulhu,"The night divides the day

Try to sell, try to buy",2024-03-06 05:27:18,4
SaltyShellback,Sub 19k was a dip. Sub 100k is also a dip. I'll be buying up to a million before making another assessment.,2024-03-05 16:30:41,3
cliff_smiff,Time preference of goldfish,2024-03-05 16:37:38,2
btc_marshmallow_test,( ͡° ͜ʖ ͡°),2024-03-05 14:56:57,2
el_rico_pavo_real,These dips are made for buying.,2024-03-05 15:07:09,2
TheMeaterEater,Kraken Pro,2024-03-05 17:06:36,2
monaarts,$300 worth of BTC 😂,2024-03-05 16:45:20,3
todwardscizzorhands,I just bought $25 on coinbase,2024-03-05 18:09:42,2
jhrfortheviews,Affirm!,2024-03-05 19:52:37,2
Ok_Art_2874,RIP Tom Petty,2024-03-05 19:54:04,2
OtherDistribution925,The buy option certainly doesn't work. The sell doesn't work too?,2024-03-05 20:04:46,2
Revolutionary-Ear279,YESS!! THIS!!! BUY!!!,2024-03-05 20:21:13,2
originalrocket,You sure?  My charts are saying 75k,2024-03-06 00:23:16,2
Ok_Art_2874,That was like so yesterday 😂😂😂,2024-03-05 23:57:49,3
JTM3030,Most panic sold and now are panic buying lol. Buy high sell low,2024-03-06 05:16:51,5
Saddath,Well record inflow for ibit...data does not look bad,2024-03-06 05:08:38,3
[deleted],This sounds viable. lol,2024-03-06 05:10:15,2
Asum_chum,A few hours?,2024-03-05 08:43:22,6
Generationhodl,Is it expensive or cheap? I only know ramen ,2024-03-05 10:07:14,5
spid3rfly,"Good on you. It's better to start with small amounts like that until you're used to the volatility. 

Keep learning. Keep dca'ing. 

And Welcome!",2024-03-06 05:36:39,3
el_rico_pavo_real,At this point I literally expect this kind of action at any moment. It's the nature of the beast. Enjoy the ride.,2024-03-05 15:06:21,2
ieatvegans,Twins!,2024-03-05 13:38:04,5
LuKeNuKuM,You won't turn it off...,2024-03-05 14:57:11,5
sonic_gottagofast_11,Always has been.,2024-03-05 14:57:05,5
btc_marshmallow_test,"It's more fun if you put your hands up!  
┗(°0°)┛",2024-03-05 15:07:08,3
StonksPeasant,Depends how short you are on fiat,2024-03-05 15:40:25,3
FrivolerFridolin,Whales dumping on the noobs,2024-03-05 16:50:55,3
Ratatablabla,"Profit taking, fueled by shorters trying to take advantage, further fueled by overleveraged longs getting liquidated. My bet is we go down to at least 55 k and then sideways for some time before we go back up. But I dont know shit about fuck.",2024-03-05 16:50:52,4
Dynatox,You're always going to have sell walls at certain notable points.  Human psychology trumps everything else in the markets.,2024-03-05 16:59:25,2
[deleted],Already did ,2024-03-05 17:20:11,3
dollywobbles,"My friend, this is the dip!",2024-03-05 20:27:37,2
StonksPeasant,Always.  I didn't have any money for this dip sadly,2024-03-05 20:28:51,2
2020redditlurker,BTC giveth and it taketh,2024-03-05 21:02:58,5
irisuniverse,MSTR,2024-03-06 02:34:02,13
RelevantPuns,"Any of the ETFs. FBTC, ARKB, IBIT, HODL",2024-03-06 05:36:44,2
[deleted],Break on through to the other side!,2024-03-06 05:14:08,3
pullupman,"Thanks for putting the Bestie Boys in my head for the day.  



Cheers",2024-03-05 12:29:34,2
btc_marshmallow_test,#TO THE MOON!!! ┗(°0°)┛,2024-03-05 15:04:33,2
gustavolm82,sure man..when you have big money to play 69k is was the moment  up and down up and down up and down.. everyone knows how to play it :D it was expected,2024-03-05 15:57:11,2
gustavolm82,im here since 68k down lol no sleep :D,2024-03-05 15:58:07,2
__Shadowman__,...you were saying,2024-03-05 16:05:20,2
Primary-Effect-3691,right?? RIGHT?!?,2024-03-05 16:10:21,6
Dont_Waver,"I'm long on bitcoin, so why do I enjoy days like today more than crab days?",2024-03-05 20:08:20,3
[deleted],[deleted],2024-03-05 17:35:08,3
Ok-Abbreviations6442,Upvoted 😎👍,2024-03-05 19:43:14,3
MinisterOfTheDog,Q12 2021,2024-03-05 10:43:26,8
StonksPeasant,"Thats $13.8 million.
The ETF inflows have been averaging over $500 million per day lately.  
They will need more than 200 bitcoin to stop that train",2024-03-05 14:19:45,12
arahaya,weeeeeeeeeeeeeeeeeeeeeeeeeeeeeeeee,2024-03-05 15:06:55,2
Real_Crab_7396,not WSB here so we're ok.,2024-03-05 16:41:26,2
SeaworthinessSad7300,What do you mean,2024-03-05 21:07:50,2
ProfessionalWelcome,I mean it already did go below 60k so there's that.,2024-03-05 22:18:14,10
DrunkandSingleGuy,"We will see 48k deep, but before we should see at least 75k, hopefully tomorrow",2024-03-06 00:00:31,3
DogCallCenter,\#WojakLife,2024-03-05 20:00:49,5
gustavolm82,no you didnt.,2024-03-05 20:01:13,3
philosophicalpango,“Finding its footing” if you will,2024-03-05 13:50:35,2
ForumHelper,"It's not illegal, just inconvenient precisely because the market would moon. With OTC you can buy in bulk at a stable price as long as supply lasts.

They will be forced to buy on the market after OTC runs out.",2024-03-05 13:14:10,4
StonksPeasant,I dont think so. Just something about some guy named Ath doing 69 with some woman named Bitty,2024-03-05 15:50:29,2
StonksPeasant,It was always going to be a sell the news event.  It'll get back there in a few days,2024-03-05 15:40:56,3
Saddath,what have you expected? BTC is doing better than I expected it. I tought it would fall to 62k straight after touching the ATH,2024-03-05 15:43:52,2
ThatInterview488,Same price as yesterday isn't a discount mate,2024-03-05 16:49:12,6
Ratatablabla,"55 k, then sideways for quite some time, then up",2024-03-05 19:43:59,2
LuKeNuKuM,Devil candle,2024-03-05 19:59:46,3
DogCallCenter,Satan's Arsefork,2024-03-05 20:02:34,3
Ok_Art_2874,"If BTC hits 300-500k, I will sell and payoff my house mortgage",2024-03-06 01:06:36,3
[deleted],[deleted],2024-03-06 00:09:34,4
smurf9913,People will hate on this answer but the ETF is by far the easiest way to cash out. Goes right into your bank account,2024-03-06 00:22:34,2
messisleftbuttcheek,There is no limit to how much you can sell in coinbase.,2024-03-06 00:31:53,2
