Author,Text,Date,Score
escodelrio,"Historical Bitcoin prices for today, March 5th:  
  
2024 - $67,340  
2023 - $22,428  
2022 - $39,396  
2021 - $48,793  
2020 - $9,060  
2019 - $3,857  
2018 - $11,331  
2017 - $1,271  
2016 - $399  
2015 - $275  
2014 - $658  
2013 - $40  
2012 - $5  
2011 - $0.90  
  
**Additional Stats:**  
  
Bitcoin's current market cap is $1.32 trillion.  
  
Bitcoin's average daily trading volume for the last 7 days is 101,671 ₿.  
  
Bitcoin's average daily number of transactions for the last 7 days is 387,684.  
  
Bitcoin's average daily hashrate for the last 7 days is 561 exahashes per second.  
  
Bitcoin's average daily price from 18-Jul-2010 to 05-Mar-2024 is $10,595.68.  
  
Bitcoin's average daily price for the year 2024 is $47,689.92.  
  
1 US Dollar ($) currently equals: 1,485 satoshis; making 1 penny equal 14.85 sats.  
  
There are currently 19.65M BTC in circulation, leaving 1.35M to be mined.  
  
There are currently 52,650,205 nonzero Bitcoin addresses.  
  
Bitcoin's current block reward is 6.25₿, which is worth $420,876.19 per block.  
  
Bitcoin's minimum (closing) price for the year 2024 was $39,556.40 on 22-Jan-2024.  
  
Bitcoin's maximum (closing) price for the year 2024 was $68,270.10 on 04-Mar-2024.  
  
Bitcoin's minimum (intraday) price for the year 2024 was $38,546.90 on 23-Jan-2024.  
  
Bitcoin's maximum (intraday) price for the year 2024 was $68,714.20 on 05-Mar-2024.  
  
Bitcoin's largest daily decrease for the year 2024 was -$3,512.30 on 12-Jan-2024.  
  
Bitcoin's largest daily increase for the year 2024 was +$5,411.40 on 28-Feb-2024.  
  
Bitcoin's all-time high (intraday) was $68,990.60 on 10-Nov-2021. Bitcoin is down 2.39% from the ATH.",2024-03-05 13:07:58,29
Old-Form8787,back to prices not seen since ... yestarday,2024-03-05 21:31:08,25
Snoopydupers,"Well, I need to send a few apology emails to my boss now.",2024-03-05 19:58:32,25
EnglishBulldog,Just a reminder that we aren't getting to a million per coin without swings in the tens of thousands of dollars.,2024-03-05 23:00:09,19
harvested,"Everyone has a story of how they 
""had bitcoin but did something with it"" or ""had the chance to buy at $x but didn't"". Everyone.

All that will matter in 10 years from now is the bitcoin you are holding on that present day. 

Buy and hold, these current price ranges will become a rounding error.",2024-03-05 10:40:27,17
HortonHearsaCthulhu,"I've never seen so much freaking out as I have in today's comments.

Of course it's going to go back up folks, and reach ever new highs. It's not like Bitcoin hasn't had dips before.",2024-03-06 00:47:58,17
TheRadishBros,"It brings a smile to my face when I see overleveraged traders get liquidated, no matter which way the price moves.",2024-03-05 16:22:04,16
Micksar,"Yesterday: “THERE’S NOT ENOUGH BITCOIN FOR ETFS AND EXCHANGES TO BUY UP! MASSIVE SUPPLY SHOCK INCOMING!

Today: “EXPECTED SELL OFF AT ATH! BETTER PANIC!”

Everyone chill. Bitcoin will continue to fly off the shelves. And the shelves will have half the amount added in 6 weeks",2024-03-05 15:44:00,15
OldPyjama,Massive sell-wall of people who had sell orders at ATH I guess. Nothing to worry about.,2024-03-05 20:33:13,15
ieatvegans,"Quick, sell your bitcoin to Blackrock. 


So they can sell it back to you at $80k.",2024-03-05 21:04:22,15
Shaantie,"Regardless if it held or not /u/Oheson 's TA tealeaves took another L. 

""Bitcoin has never hit ATH before the halving and never will.""",2024-03-05 15:17:51,14
TexasBoyz-713,"I had 3 chances to take profits at 69k. Once in 2021, and twice in the last two days. Did I secure anything? Nope, but I got a cool screenshot of Bitcoin at 69k, that has to be worth something right??",2024-03-05 16:12:41,13
CohibasYMamitas,Wow Bitcoin hasn't been this low in.... 48 hours lol,2024-03-05 20:50:15,12
DrunkandSingleGuy,Cramer told that Bitcoin topped. We are safe. 75k next week🥳,2024-03-06 02:16:35,13
Confident-Land4117,"Tbh ath to me is 70,000. That is the wall to breach",2024-03-06 03:31:25,13
speedskis777,Recovering nicely off that 67300 flush... the short squeeze beatings will continue until morale improves 😈🚀,2024-03-05 06:23:11,13
btc_marshmallow_test,Lotta weak hands at 69,2024-03-05 15:05:48,11
dukemaskot,I was here when btc hit its all time high!,2024-03-05 15:18:19,11
Micksar,The old ATH dump that everyone saw coming.,2024-03-05 15:25:20,10
RecessionGuy,"ETF flows for Monday: https://farside.co.uk/?p=997

BTC amount: https://www.bitcoinstrategyplatform.com/etfs",2024-03-05 06:14:30,11
samcornwell,A subtle difference about this cycle is a lot more noobs are asking about the halving in this sub. If my memory serves me correctly the rallies previously have come after halving.,2024-03-05 07:36:47,10
DarkKitten13,Just as usual. It'll bounce off of the ATH a few times with big sell-offs and one day all of a sudden it'll blast through and give us a 10% daily candle,2024-03-05 15:12:02,10
franciscoanconia,The correction you've been waiting for.,2024-03-05 16:05:03,11
[deleted],"And then it **CRAAASHED* back down to 65k .. And then this one time, etc...",2024-03-05 17:02:54,10
SpecialDonkey6563,I can’t believe Bitcoin crashed to 1K higher than it was 24 hours ago.,2024-03-05 17:17:47,10
andyszal,"Welcome to the thunder dome moon boys. 

Bitcoin is the big leagues. Embrace the volatility.",2024-03-05 23:17:14,10
2ManyAccounts24,OMG GUYS WE HAVEN'T SEEN THIS PRICE SINCE YESTERDAY!?! IS THIS THE END OF BITCOIN!?,2024-03-06 00:38:02,9
CitroenKarin,Maybe the real ATH was the friends we made along the way,2024-03-05 20:12:36,18
Middle____Earth,"Massive sell off which I expected, need all the profit taking at new ATH to cool off before it gets rolling again now",2024-03-05 15:06:08,8
Ruzzkya,The amount of sell orders at 69k is crazy,2024-03-05 15:14:05,9
quantum_tunneler,huge sell pressure at 69k it seems. probably need a few days to eat up the supply.,2024-03-05 16:02:08,10
Micksar,Today is reminding me that I intended to avoid all of you during this bull run lol,2024-03-05 16:51:17,8
my__ANUS_is_BLEEDING,No one knows shit about fuck. Just ride the Rollercoaster,2024-03-05 19:51:36,9
Ruzzkya,"Guys, thank me later. I set an order to buy at 59000 and the dip was 59005 on binance, it wasn’t completed because of 5 bucks. If it wasn’t for me we’d still be falling",2024-03-05 20:08:40,9
Ghostserpent,Goodbye short term sellers. See you at 100k,2024-03-05 20:14:31,8
R3dFiveStandingBye,Damn it’s as low as it was…. *checks notes* … Sunday,2024-03-05 20:30:24,9
JohnnyMofo,Bitcoin declaring bankruptcy and closing its doors after a solid 15 year run!,2024-03-05 20:57:02,9
gustavolm82,"media behaving very biased and strange about bitcoin today.. many journalists literally marketing hard bitcoin here in my country, many telling news as it just reached its ath and then doing mkt about bitcoin, not even mentioning it gone down after it..",2024-03-05 22:15:34,9
hustleman23,Just got home for the day.  Not bad at all. We needed to flush those sellers out.,2024-03-06 00:40:04,9
tesseramous,Fiat having a dead cat bounce,2024-03-06 01:26:02,9
Micksar,Thankful that I lived through the fall from 69k to 16k back up to 69k so I can recognize that panicking over stuff like this is silly.,2024-03-05 17:27:06,18
ZachCope,"I’ve just woken up from a 10 year coma. I withdrew 3500 bitcoin to my laptop from MtGox before I got hit by an out of control shopping trolley.
What did I miss? ",2024-03-05 06:12:04,17
ForumHelper,"BlackRock lists their holdings here: [https://www.ishares.com/us/products/333011/ishares-bitcoin-trust](https://www.ishares.com/us/products/333011/ishares-bitcoin-trust) 

Can anyone explain what the negative FX entries are?",2024-03-05 11:55:00,8
el_rico_pavo_real,"Bought BTC yesterday, bought more FBTC today. I'M DOING MY PART!",2024-03-05 14:32:29,8
BigDeezerrr,bringing the battering ram back around...,2024-03-05 15:18:52,8
Dry-Stand5342,Blackrock has already bought 26mil worth of btc since market open,2024-03-05 16:08:54,8
DontTellSmokey,"Got two buys in around 65,000. Feeling good about it.",2024-03-05 16:30:31,8
raddoc22,It's going up forever Laura.,2024-03-06 00:31:05,8
Ruzzkya,"All ETF’s flow table for those who can find:

https://farside.co.uk/?p=997

Today we are going to see a huge inflow of fomo after flirting with ATH yesterday. Check your seatbelts!",2024-03-05 13:23:02,7
BigDeezerrr,lol lotta all time high sell orders triggered. We'll be coming around for another go soon I bet,2024-03-05 15:06:48,8
DontTellSmokey,Honestly if we go sub 65 I might scoop a little more,2024-03-05 15:26:16,6
displaybeats,Anyone else remember the “ITS OVER 9000” memes?,2024-03-05 15:46:25,7
EDWARD_SN0WDEN,I remember the struggle to get to this point last cycle. No one gives a shit this time around omg,2024-03-05 15:53:22,6
MrBrawn,"Pack it up it's over guys, this is the end of Bitcoin.  /s",2024-03-05 16:06:58,6
UrethreaFranklin1,Well you knew that was coming. How many sell ordered it when it crossed over. Wow.  Fucking love it!,2024-03-05 16:26:09,7
Vinnypaperhands,Who are the morons who are actually selling right now..... I'm kinda dumbfounded lol. This mufucka is going over 70k whether the haters like it or not.,2024-03-05 17:16:55,7
goldenprey123,Thanks for the dip nerds (I’m down 3k),2024-03-05 17:42:33,7
TwoInchTickler,"Someone post downwards rollercoaster coin! 

(Also, any first timers - this happens, and thus far there is no time in history at which it hasn’t then recovered, as shown by todays ATH. Breathe :) )",2024-03-05 19:24:07,7
Wobbalabba776,Here comes the other part of the roller coaster meme that everyone forgets about!,2024-03-05 19:45:19,7
10ele,this always happens. chill people,2024-03-05 19:48:32,6
mediocregolfer123,This price action is absurd lol,2024-03-05 19:59:31,6
Dont_Waver,That's a $10k swing in a single day. It's going to get wild from here,2024-03-05 20:04:11,8
unihb,Liquidating a ton of leveraged longs + triggering laddered stop losses. There's so much inflow coming in from the ETFs that will gobble up this downward swing in no time (guessing a day or two). I'm sure lots of people had sell orders at the previous ATH + whales trying to shake out the leverage to buy lower.,2024-03-05 20:50:00,8
goldenprey123,What a fucking morning,2024-03-05 21:30:09,6
NutInHerAzz,"The last time that BTC had a more than negative 10%  candle was Nov 9, 2022 were it went down -14%. (FTX Crash)",2024-03-05 21:56:34,7
nickjbedford_,"Can anyone tell me when the Bitcoin CEO is planning another dip?

/s",2024-03-05 22:01:58,8
URNape2,"""crash"" to 64k lmao",2024-03-06 00:25:28,7
messisleftbuttcheek,"Net inflows from ETFs today was 662 million, triple the previous daily average. Bullish",2024-03-06 04:49:31,8
amazingalcoholic,Fuck if I’m getting out of bed and playing Balatro and watching the charts,2024-03-06 05:28:42,7
philosophicalpango,Am I alive rn? Dreaming? Is this what the rewards of making a good choice feels like?,2024-03-06 05:30:22,7
mercistheman,It's a good morning to start with some rat poison breakfast with a side of no intrinsic toast.,2024-03-05 07:44:34,12
Suspicious-Composer8,A little breather is always healthy,2024-03-05 08:21:39,12
TexasBoyz-713,It’s the ATH. Some rejections from it are expected with all the sell orders people probably have. We will claim 69k eventually.,2024-03-05 15:07:02,12
bwhough,"The expected rejection, but we held $69k longer than I thought we would that stretch!",2024-03-05 15:06:00,6
vnielz,"Degen 100x’s Liquidated✔️

Resume the mission to moon🫡",2024-03-05 15:12:14,5
FrivolerFridolin,"Bitcoin: ""i didn't hear no bell""",2024-03-05 15:14:49,5
afschmitt,"Here comes retail….

https://www.nytimes.com/2024/03/05/technology/bitcoin-price-record-high.html?smid=nytcore-ios-share&referringSource=articleShare",2024-03-05 15:14:52,6
el_rico_pavo_real,It's crazy to think that everyday the ETF funds have to reconcile their spot BTC holdings with the ETF inflows. Billions of dollars everyday.,2024-03-05 15:25:52,6
Phitzdisco666,We are up like 19% this week you guys have to chill this was expected. And we are still up from yesterday.,2024-03-05 15:47:33,6
cryptoenthusiast84,"For those of you crying for a cheaper price so you can apparently buy, now’s your chance. Let’s see if you actually take it",2024-03-05 17:13:44,5
crypt0noob,Just shaken out the weak hands.,2024-03-05 19:20:08,6
TwelvestepsProgram,Well i figured once we touched the naughty 69k we would get slapped. Well here we go!,2024-03-05 19:37:59,6
URNape2,"The corn giveth, and the corn taketh away.",2024-03-05 19:54:59,6
Llonga,Noobs rekt,2024-03-05 19:59:38,7
Ugo_foscolo,Said hi to a - 10 day like an old friend.,2024-03-05 20:24:13,6
Dry-Stand5342,"Thanks for the btc, sellers..lmao",2024-03-05 20:35:17,6
Isantum,Whoa Bitcoin CEO running an ATH flash sale!,2024-03-05 20:52:49,5
hustleman23,Damn. Inflow of over 780 million for Blackrock today,2024-03-06 05:15:48,6
el_rico_pavo_real,"Right now we are in a critically important phase of clearing out the many top buyers who have been waiting for this moment to exit for years now. Once they are gone the resistance resets. Patience and accumulation will go a long way here, IMO.",2024-03-05 15:26:53,18
spid3rfly,"Wow! With the run up to the all time high and drop not long after, this is the first time I've seen hosts in media try to dumbdown the halving/built in monetary policy to keep new investors(likely the ETF boomers) from freaking out and selling. (The host take a timeout to talk about the halving and things at 3:30). The guest on also touches on some of the mining/energy/stranded energy topics that we've all heard for a while now. 

This is so crazy to see it on one of the ""main"" financial news networks. 

[https://www.youtube.com/watch?v=G14RF4GpOhM](https://www.youtube.com/watch?v=G14RF4GpOhM)",2024-03-05 21:33:33,10
Generationhodl,"Man, some of the guys at work are really lost. They go to vacances 3-4 times a year, make several weekend trips to other cities, buy expensive consumer products and so on.

Then they tell you they had no money to invest in bitcoin when it was below 20k. 

But of course, now it will be better they say, they just wait for a good drop again. 

Sometimes I feel sorry for them. They are so caught up in their expensive consumer lifestyle without any monthly savings that they will have to work until they are old, and the chances are high they won't even get a good enough pension in 20-30 years because government will continue to fuck up the currency. 

They are so busy working their asses off just to buy useless shit or get to the vacation in order to forget for a brief moment of time that they are caught in the neverending rat race and their purchasing power is going downhill over the years...",2024-03-05 09:47:28,14
TwelvestepsProgram,Okie that was amazing! 69k then BOOM SELL WALL.,2024-03-05 15:07:15,11
DogoByte,*\*puts the champagne back in the fridge*,2024-03-05 15:13:24,10
hateschoolfml,Even after the death of fiat money there will always be an unlimited amount of global productivity to flow into the only scarce asset in the economy,2024-03-05 12:29:16,6
Get_the_nak,"Look out I think ATH $68 991,85 is in danger",2024-03-05 14:52:22,6
CJKayak,"November 2021: $68,991.85

It is time for you to sleep now.  You did your part.  You did it well.  You'll be remembered.",2024-03-05 14:56:54,4
EDC86,Welcome to price discovery boys,2024-03-05 15:05:07,4
DontTellSmokey,Imagine selling here,2024-03-05 15:07:57,5
TrippingBananas,Well that was quick,2024-03-05 15:18:50,6
MindlessProduce7997,69 for a little appetizer,2024-03-05 15:19:44,4
TaiwanDankBoi,There is no second best. There is no second best crypto asset.,2024-03-05 15:25:06,4
Ruzzkya,"You guys keeping saying “don’t sell” to folks in here, this craziness we’re seeing is a consequence of the big guys speculating. Mf buys 100 coins at 66k and sells at 68k for 200k profit, in ten minutes. Who fucking wouldn’t?",2024-03-05 15:41:58,5
[deleted],[deleted],2024-03-05 16:19:49,5
vnielz,"
degen gamblers belongs to casinos. 
Nukem’all.",2024-03-05 16:24:32,5
Vinnypaperhands,With this kinda of volatility I wouldn't be surprised if we are above 70k in a few hours lol. Let the idiots dumb now but this thing is going to rip right back up in no time at all,2024-03-05 17:19:02,4
[deleted],All the noobs are selling low now,2024-03-05 17:20:36,5
BitcoinBaller420,"I just bought very near the all time high, most expensive bitcoin I've ever purchased.  Feeling great about it.  Assets often have dips after breaking all time highs, have patience.",2024-03-05 18:00:23,5
EmuSea4963,Wheeeeeeeeeeeee!!,2024-03-05 19:49:55,6
HurricaneHarvey7,Yeah I'm turning off the charts and doing something else now.,2024-03-05 19:58:15,5
juliettefriskey,Shake & Bake the paper hands.,2024-03-05 20:01:01,4
NutInHerAzz,"You wanted free internet money, well there you have it.",2024-03-05 20:04:24,5
Background_Floor_118,who else can't buy/sell from coinbase right now?,2024-03-05 20:25:37,4
Ghostserpent,Bought calls at the bottom. Will be up 200% if we can hit ATH again tomorrow.,2024-03-05 21:16:26,4
VampIre_HRST,If BTC breaks 70K this month I am giving away my GSX-R 600.,2024-03-06 00:44:59,6
RecessionGuy,"GBTC outflow for Tuesday just came in: -$332.5 million. Relatively moderate, seems like the miners/whales had a bigger impact. https://farside.co.uk/?p=997",2024-03-06 01:05:48,4
DragonfruitMean9214,Send this mofo to 500k ,2024-03-06 04:05:43,4
[deleted],You know the day destroys the night,2024-03-06 05:22:43,4
sio746,Are people being serious on here when they say buy the dip / discount? It was literally that value like yesterday. Swear it's a mad house here sometimes.,2024-03-05 16:19:36,8
PheelGoodInc,Oh no. We dumped to prices not seen in *checks charts* two days!,2024-03-05 18:02:10,8
Tron_Passant,Little pullback is healthy. I bet we see a new ATH this afternoon. ,2024-03-05 11:31:55,9
CJKayak,"There it is.  Coinbase $69,000.  

I'm just glad to be here hodling with you guys.  See you at $100k.",2024-03-05 15:02:45,9
Get_the_nak,Congratulations everyone who managed to buy the dip after the new ATH!,2024-03-05 18:01:01,8
SatanZilla,"Very close to new ATH today, we'll bounce back from 69k some times, then tomorrow we will start the day with the FOMO spreading",2024-03-05 14:44:28,4
FrivolerFridolin,0.8 % is needed,2024-03-05 14:47:27,4
el_rico_pavo_real,I need to be studying GI anatomy but DAMN this is so distracting!,2024-03-05 14:52:24,4
irisuniverse,I was here,2024-03-05 14:53:02,5
el_rico_pavo_real,"I personally love the fact that ETF flows directly affect supply/demand of BTC. It's a win/win. For me, I have my BTC in cold storage, but since I never want to sell that, I'm going heavy into FBTC so that I can eventually sell and benefit in the mid-term.",2024-03-05 14:54:34,4
Visara57,Anyone wanna 69 ?,2024-03-05 14:55:08,3
vnielz,70k comingggg,2024-03-05 15:04:51,5
ProfessorSerious7840,cliffff,2024-03-05 15:05:28,4
mage14,SHINE BRIGHT LIKE A DIAMONDDDDDD 💎💎💎,2024-03-05 15:06:44,4
fCorruption,It’s just a matter of time.,2024-03-05 15:07:02,4
AssmunchStarpuncher,WHEEEEEEeeeeeeeEEEEEEEEeeeeeeEEEEEE!,2024-03-05 15:07:10,5
Flurb789,"All of this climbing to ATH then dumping is like a Ferrari revving its engine at the starting block. 

Gonna be huge when the light finally turns green.",2024-03-05 15:36:28,5
Primary-Effect-3691,Just step away from the monitor for an hour folks,2024-03-05 15:40:07,4
Financial_Design_801,Stacked at $69k ha beat that,2024-03-05 15:54:18,4
Barnyard_Rich,It's a shame stop loss hunting works as well as it does.,2024-03-05 16:12:52,3
quantum_tunneler,when are we bringing out the rollercoaster guy again,2024-03-05 16:17:14,5
thisbitbytes,Sats on sale!! One hour only!!,2024-03-05 16:18:19,3
NectarineDirect936,Any other low fee exchange i can use instead of cb? Really fed up with this nonsense,2024-03-05 16:25:51,4
DaRealElonMusk,SELLING EVERYTHING IM SELLING ALL MY 300 BTC,2024-03-05 16:32:24,4
F3TGM5bpGG0S,'Tis but a flesh wound',2024-03-05 17:10:20,3
AriesThef0x,"Buying the “dip” at multiple price points on the way down

“Am I the whale now?”",2024-03-05 17:38:53,4
__Shadowman__,This doesn't feel like an ATH kinda day lol,2024-03-05 18:16:33,4
plxnk,Coinbase sucks ass.,2024-03-05 19:12:56,4
x2manypips,noobs getting slaughtered,2024-03-05 19:40:28,3
x2manypips,Imagine not buying this dip,2024-03-05 19:43:20,3
HurricaneHarvey7,Probably GBTC dumping a fuck ton or some bullshit like that.,2024-03-05 19:43:27,5
[deleted],[deleted],2024-03-05 19:49:49,5
Wsemenske,Coinbase seems to have turned off the buy/sell option? Down again lol?,2024-03-05 20:03:33,5
DarkKitten13,"Haha. Very funny. But seriously, time to stop being funny and getting back to green",2024-03-05 20:05:40,4
TheCommodore777,lots of newbies itt,2024-03-05 20:08:48,5
Revolutionary-Ear279,BUY BUY BUY BUY,2024-03-05 20:15:37,4
Affectionate_Rest722,Hit the ATH….people took profits…..and we start all over again,2024-03-05 20:51:00,4
wifi_god69,"Don’t worry boys, we’ll be back soon 😤",2024-03-05 21:11:12,4
HurricaneHarvey7,Max pain would be if we slingshot to $80k,2024-03-05 23:40:50,4
Get_the_nak,64k!!,2024-03-05 23:55:52,4
Chiropractic_Truth,Next leg up incoming.,2024-03-06 01:33:50,4
HurricaneHarvey7,I'm gonna lmao if I wake up to $70k,2024-03-06 05:01:51,3
x2manypips,Ok guys we might see 70k tomorrow,2024-03-06 05:15:24,4
Frogolocalypse,Reeeeeee!!!,2024-03-06 05:20:10,3
Get_the_nak,66k !!,2024-03-06 05:38:07,4
llewsor,bitcoin: and i’ll fuckin do it again!,2024-03-06 05:52:56,5
Green-Music2366,It's crab sandwiches for a while now boys.,2024-03-05 08:37:21,9
btc_marshmallow_test,#THIS IS GENTLEMEN!,2024-03-05 15:02:48,7
SaltyShellback,Guys i think Bitcoin is dead again?,2024-03-05 16:32:41,7
el_rico_pavo_real,Love seeing all the shorts and buttcoiners coming out of the woodworks on a pullback.,2024-03-05 17:30:08,6
x2manypips,Wow it went up like 200% then fell 5%,2024-03-05 19:11:53,8
vnielz,*Pullbacks in bull markets are very healthy*,2024-03-05 19:16:33,7
Ghostserpent,This correction was needed. Too many traders in the market to pass ATH,2024-03-05 19:21:53,7
PlasticHot7188,"i just put my first $100 into bitcoin an hour ago and have already made $5.

if these returns are not consistent i will be furious.",2024-03-06 05:34:41,8
Green-Music2366,Here we go again.,2024-03-05 14:44:39,7
HurricaneHarvey7,Oh come the fuck on.,2024-03-05 15:05:17,6
Blex98,I was here. From the class of 2020.,2024-03-05 15:05:21,6
SoullessGinger666,Sir a 2nd red candle has hit the charts,2024-03-05 15:05:48,6
New-Connection-9088,"Coinbase is for sure going down again. This is some crazy volatility and volume. They just traded 1,600 BTC is a single 5 min candle.",2024-03-05 15:08:12,5
Krayge,And here... we... go... 🚀,2024-03-05 17:39:10,7
Anzu_Yamasaki,last chance to buy above 61k,2024-03-05 19:38:04,6
MarcVincent888,insert :Matthew Mcconaughey Cigarette Meme: here,2024-03-05 19:59:06,7
x2manypips,Last dip before 250k,2024-03-05 20:30:22,6
ForumHelper,"Longs removed, now removing shorts and then we can resume the scheduled program to reach 100k :D",2024-03-05 21:20:40,6
samcornwell,"Dear mods,

Please pin the daily discussion post to the top of the sub.",2024-03-05 07:02:09,8
Confident-Land4117,"Cmon push take a deep breath, push....oh I can see the head...btc about to give birth to new ath",2024-03-05 13:35:07,8
monaarts,Starting the ride back up to a new ATH!  🚀,2024-03-05 12:39:07,3
Green-Music2366,It's all going green again.,2024-03-05 13:05:32,3
vnielz,Almooooosstttt,2024-03-05 14:45:53,3
eyedude2898,The beauty of absolute digital scarcity meeting supply and demand. This is what we've all been waiting for.,2024-03-05 14:54:42,3
japanb,"10 mins before bed, midnight in asia and it started going up, will it get to 69 by the time i turn off the laptop",2024-03-05 14:55:20,3
Yeti_racer,And... here... we... go...,2024-03-05 14:55:27,3
sinbad-633,Only a matter of time now folks.,2024-03-05 14:56:08,3
Excellent-Average580,In it to win it 🚀🚀🚀🚀🚀🚀🚀🚀,2024-03-05 14:57:19,3
No_Drama_1159,Come on babyyy,2024-03-05 14:57:56,3
sinbad-633,Edging,2024-03-05 14:58:56,3
HurricaneHarvey7,Oh come on,2024-03-05 15:00:30,3
btc_marshmallow_test,Chewing through the wall!,2024-03-05 15:01:09,3
Morlaix,To infinity and beyond!,2024-03-05 15:01:43,3
LeWahooligan0913,ETFs: *Activated*,2024-03-05 15:01:48,3
silentcanon1,ATH incoming!,2024-03-05 15:02:16,3
eyedude2898,69 IS BEING BREACHED,2024-03-05 15:02:30,3
HurricaneHarvey7,WE DID IT,2024-03-05 15:02:58,3
WillTheOnly,History!,2024-03-05 15:03:39,3
Middle____Earth,Live BTC trading finally shows $69k,2024-03-05 15:03:40,3
bloodyburgla,Yeh put it on the board!,2024-03-05 15:03:43,3
DaRealElonMusk,LETS GO ATH BABY ALMOST THERE,2024-03-05 15:03:51,3
SoullessGinger666,NEW ATH,2024-03-05 15:04:01,3
celebration123456,69 baby,2024-03-05 15:04:27,3
DaRealElonMusk,I WAS HERE TO WITNESS HISTORY,2024-03-05 15:04:33,3
monaarts,"$69,420 coming up and about to be knocked the F down!",2024-03-05 15:04:38,3
HodlingBackTheYears,Like Michael Saylor dressed as a hotdog taking flight through a hallway.,2024-03-05 15:04:48,3
UltimaSpes,We are so close to making history again,2024-03-05 15:04:59,3
anynonus,I'm refreshing coinbase. It's not real until it goes out,2024-03-05 15:05:09,3
DaRealElonMusk,Holy fuck it just tanked 1k,2024-03-05 15:06:07,3
Llonga,<<Dennis Nedry wagging finger GIF>>,2024-03-05 15:12:34,3
peeeeeeet,Round two ding ding,2024-03-05 15:14:58,3
DaRealElonMusk,I WAS HERE!,2024-03-05 15:15:26,3
SwAyWithSkill,Mommy,2024-03-05 15:25:14,3
Micksar,Someone let me know when the dip stops dipping so I can toss more fiat in.,2024-03-05 15:32:54,3
HurricaneHarvey7,We suck again..,2024-03-05 15:33:11,3
