Author,Text,Date,Score
CoogleEnPassant,"That's not the whole picture though. Besides corporate greed, you will also see then blaming it on corporate greed",2024-02-22 19:46:14,13
EazeeP,"🔨

Lmaoooooo you got it soooo right

I primarily think it’s cuz redditors are left leaning and align with woke ideologies which primarily focuses on blaming capitalism and misdirecting their anger on symptoms and not root causes",2024-02-22 19:50:48,12
[deleted],[deleted],2024-02-22 20:05:07,0
HumbleBitcoinPleb,No.,2024-02-22 21:31:10,4
DontDieSenpai,"Indeed, and I'm one of those people far more interested in watching the status quo unravel itself than in ""number go up"" nonsense. 

It's infinitely more fascinating to watch their nonsensical philosophy begin to burn down before us. Many may deny this is happening, but whether or not they concede today matters not; they will eventually be forced to do so when their precious Keynesianism is a pile of smoldering ashes.",2024-02-22 22:20:02,7
DontDieSenpai,"I take issue with this kind of response.

They *are* both *technically* correct. CPI *is* a measurement of inflation. It's an *inaccurate* and deeply *misleading* measurement, but it *is* a measurement of inflation.

We aren't going to convince anyone if we lob ad hominem fallacies around like Oprah handing out bags of shit to her audience, we have to extend *some* grace.",2024-02-22 23:16:14,2
Brusanan,"Everything they hate about Capitalism is actually caused by *government*, and their solution to these alleged flaws in the capitalist system is even more government.",2024-02-22 23:37:47,3
Lonely_Cold2910,But the politics create the laws that affect your bitcoin.  Like shutting on and off ramps to fiat.  Taxation of your btc. .,2024-02-23 11:25:10,1
MidnightStories32,"Bitcoins cool to invest in, but it’s not recognized as a currency in the majority of earth. Also, people don’t seem to care about Bitcoin. Like, at all. It’s estimated that 80Million people use Bitcoin, which is less than 1% of earths population.

Everything about Bitcoin is theoretical in nature, so I’m not going to say if it’s a better system or not. Because the answer is that no one knows.

We also don’t know if regulation in major populated areas will benefit Bitcoin. It’s in its infancy, which is what makes it inherently risky.

What I do know, is that the Keynesian economics brought a great deal of wealth to those that wanted it. Far more than bitcoin did in that timeframe.

That being said, I’m not for stimulus either.",2024-02-23 02:31:28,1
equity_zuboshi,">It's one thing to actually understand economics and still be a communist.

That is impossible. being a communist requires either ignorance of economics or outright denial of reality. You cant understand economics and also believe in communism, because the two are mutually incompatible on a very fundamental level.",2024-02-22 23:04:00,9
Lonely_Cold2910,The richest people on earth may not know economics but they sell a product or service that makes them billions.  The current system works for them.  Would they even think about bitcoin?,2024-02-23 11:32:21,3
Robin_Ape_Williams,"My bad, here is the full video: https://x.com/SimplyBitcoinTV/status/1760722798828310748?s=20",2024-02-23 14:20:08,1
Present_Air_7694,Keep supping the Kool-aid,2024-02-27 15:32:01,0
jmomentum,We are all just temporarily embarrassed billionaires aren't we... Soon enough the hard work will start paying off.,2024-02-22 20:22:24,1
daemonpenguin,"That was pretty much my thoughts, yes.

Bitcoin, while an interesting technology, actually makes the problem of wealth inequality worse because its community is fairly small. Most BTC is owned by a small number of people who can manipulate its price fairly easily. People who can afford to invest large amounts early can game the system (we tend to see this during spikes and valleys in BTC price).

There are lots of reason to like and enjoy Bitcoin, but wealth distribution is actually an area where it's probably doing more harm than good. At least in the short term. That may change as it's more widely adopted and understood.",2024-02-22 18:34:00,3
Superman246o1,"Ironically enough, Bitcoin was once cheap enough to give many socioeconomically-challenge people a chance at becoming rich.  

Those who were smart invested early.  

Those who were dumb and listened to people who ""knew better"" -- and I was one of these people, much to the detriment of my net worth -- did/will not invest until BTC cost far more than it once did.",2024-02-22 20:28:47,3
equity_zuboshi,">Yep. Fiat is more distributed than bitcoin

what matters with fiat is not balances, but the ability to print it.

That is not evenly distributed in fiat, and its the only thing that matters.

While bitcoin has no ability to be diluted, so it is equal to everyone.",2024-02-22 23:05:49,1
daemonpenguin,"> Your Source: Trust me bro

No, my source is the published charts of Bitcoin distribution which show most BTC is owned by a small number of people. The majority of BTC holders only own a few percentage points of the whole BTC pool.",2024-02-22 18:30:18,4
LunaGuardian,"Saying that bitcoin is ""backed"" by anything just adds to confusion. Money being ""backed"" is a fiat thing, by saying this inherently worthless paper is redeemable for a commodity of value, like gold. Bitcoin *is* the commodity; it need not be backed by anything. It has value from its own utility and scarcity.",2024-02-23 02:07:28,26
PomegranateDry4424,All the money is based on the faith of the people that use  it. Bitcoin included.,2024-02-23 07:46:28,6
Putrid_Pollution3455,"Dollars are backed by the government and the war machine, basically a big bully.",2024-02-23 10:25:50,5
spearsy33,And energy…,2024-02-23 02:05:35,1
2LostFlamingos,"You too my friend. 

Years later they can talk about how “lucky” we were.",2024-02-23 17:22:13,2
ExternalMonth1964,"Step 1. Buy btc

Step 2. Lambo",2024-02-23 03:28:24,3
2LostFlamingos,"Oh yes. We’ve discussed it at length. I didn’t want to preach to the choir here. 

Limited supply, permissionless, inflation-proof, no need for third party…. Recommended books and for them to learn more about the history of money 

I got all the cliched responses of criminals, pollution, crypto bros and “everyone knows the US dollar is fully backed.”",2024-02-22 22:44:44,1
celestialhopper,Everyone buys bitcoin at the price they deserve.,2024-02-23 04:57:14,1
iWearSkinyTies,"You're wasting your time my friend if you think you will convince people like this. Although someone on the fence could use your comment to finally drive the point home, so there's that I guess.",2024-02-23 03:32:02,1
Disastrous-Dinner966,"What adoption are you even talking about? None of you guys even use it. You just hoard it and stand guard over your hardware wallets waiting for someone else to find a use for it. There is no adoption. It has no uses other than as an asset. Why is this so difficult to comprehend? It's literally the worst, slowest, most expensive solution on offer for global payments and no matter how you kludge it with layers upon layers of extra networking to try and fix this, nothing changes the fact that the protocol is good for one thing and one thing only, and that's all it will be used for in our lifetimes.",2024-02-22 22:49:16,-1
HippoLover85,"Cans of soda and consumer goods are what drives the majority of all economic activity. Home depot runs, grocery store, paying rent, buying clothes, paying a medical bill, etc etc.

yes, i think you would take chunks of gold off. As you can, at any time, get gold for your USD. the two are completely interchangeable with fiat.",2024-02-22 23:14:52,-1
HippoLover85,"Ive actually already used it a little bit. I have cashapp, and last time i used it i had to pay \~10-20 in fees (could have been more). It is not something i am interested in using again due to its prohibitively high costs.",2024-02-22 21:37:58,0
HippoLover85,I was not. Ive read a little about it. Curious how you think this fits into bitcoin and currency.,2024-02-22 23:12:58,1
HippoLover85,"You can assume in my post that i am referring to money, not currency. My mistake.",2024-02-22 23:55:20,1
HippoLover85,I don't view inflation or deflation as theoretical. That isnt what i meant.,2024-02-23 01:48:44,1
TechHonie,Why? I mean I care about them in the sense that I understand they need to be managed lest they get out of control but that's about it.,2024-02-23 15:05:18,0
zenethics,Or corporate greed for that matter.,2024-02-22 20:16:26,9
FaultyVulcan,"I don’t think leftist blame capitalism as portrayed by right wing or libertarians. They complains about unchecked, unregulated capitalism. They complain about a capitalistic system that allowed profits over people. Just my opinion as a leftist bitcoiner.",2024-02-22 22:15:23,-2
akoster,"I can only assume you have been indoctrinated by the old 1980's views, that economists have resoundingly found are hogwash.",2024-02-22 21:38:25,-1
johnfintech,">far more interested in watching the status quo unravel itself than in ""number go up"" nonsense

A ship that big takes a while to sink. But it does sink. What you said in the quote above is perhaps more profound than you intended it, because it is fundamentally the measure of how much we trust and contribute to Bitcoin's success for the right reasons. I posit that that actually matters in the long run. Bitcoin is not in fact fully immune to the diseases that lead to the current cancer we call modern monetary system.

As for the two schools of thought, I just replied to [this guy](https://www.reddit.com/r/Bitcoin/comments/1axccd4/comment/krofj0f/?utm_source=share&utm_medium=web2x&context=3) before I saw your reply. He/she seems to be exactly as described. Spot on.",2024-02-23 01:17:09,4
equity_zuboshi,">It's an inaccurate and deeply misleading measurement, but it is a measurement of inflation.

Lol, so iow its incorrect

>We aren't going to convince anyone if we lob ad hominem fallacies around

I used to think so too, but have come to see I was wrong.

You cannot logic someone out of a position they didnt use logic to get into.

Leftists dont care what the reality it, their feelings based argument start from a conclusion, and they will support any crooked math to support it that some huckster is willing to shovel.

The way to force them into reality is to openly deride and mock them. Thats it. They cant stand it.

> like Oprah handing out bags of shit to her audience, we have to extend *some* grace.

when near ophrah, wear blue.",2024-02-22 23:29:01,2
jerrycatsu,Making stuff up is fun,2024-02-23 08:37:40,0
FaultyVulcan,True. Early adopters are rewarded handsomely.,2024-02-23 00:28:58,2
anon-187101,🎯,2024-02-23 02:24:29,6
GlitteringBelt4287,"I agree it doesn’t help people understand when you say it’s backed by anything. 

You don’t say gold is backed by anything. Bitcoin isn’t either. It’s governed by math, thermodynamics, and economics but it isn’t backed by anything.",2024-02-23 13:39:08,3
magocremisi8,"and the decentralization of the network, and the financial / game-theory incentives to not attack the network, etc, but sometimes simple is best!",2024-02-23 02:06:42,1
InternationalTwo5255,"We all really need to stop with the lambo schtick. It’s *not funny* anymore, and it makes us look like a bunch of losers.",2024-02-23 03:42:34,1
bobbytabl3s,Step 1.5. Hodl,2024-02-23 06:26:39,1
InternationalTwo5255,"What does this mean, exactly?",2024-02-23 05:00:50,1
artAmiss,It's the most important use case.,2024-02-22 22:50:46,5
johnfintech,"Tell me how much history of money do you know without telling me how much history of money do you know. Gold used to be currency. It transitioned to store of value with the widest and most solid adoption among those who matter, i.e. those who hold the vast majority of wealth on this planet, all the way up to banks and state treasuries. Why has that transition happened?

Do you realize you're the only one in here talking about bitcoin L1 being used to buy coffee? Everyone moved on from that many years ago. L2 will be used for that, and there already exist circular (micro) economies based on it in some developing/underdeveloped states which has been saving people from being financially buried by hyperinflation.

You're living in the past, and are uninformed. There is causation between those, but not sure in which direction in your case.",2024-02-23 00:39:07,2
Grouchy-Ad981,"Hurm, there is no adoption goin on?... just a trillion dollar market cap Vs gold at about 13.6T. Then the launch of BTC ETFs. The most successful launch EVER. (i dont buy em tho, not my thing). As for everything else you said, almost sounds like you dont have bank accounts or have never transferred money before. Or what its like to have someone water down your kool-aid. (your fiat is getting watered down everyday.) But heres there real kicker facts baring all opinions. From 2020 to 2023, just 3 years, the dollars purchasing power has decreased by 18-22% depending what snapshot u look at. 18%!.... Now since 1971, its has decreased 98%!! in little over 50 years, 1 million dollars, baring any interest or investments, would buy you 50k today. Seems like a solid investment to me....no? yea i vomited too. Knowing thats the outlook for the next 50...",2024-02-23 00:53:56,3
Gmoneymoney7,"have you looked into using a lightning at all?  


i have phoenix, i can send from cash app to phoenix for pretty cheap (<$1) and after that fees are basically negligible.",2024-02-22 21:42:46,5
lazertazerx,"I may have misunderstood, I thought you were arguing the typical point that ""Bitcoin is fake because it's not easy to use as a currency"". But now I'm not so sure, maybe you were just explaining why this is a popular argument against Bitcoin.",2024-02-23 00:03:04,3
CoogleEnPassant,"I mean yeah, they will. But my point is that it's mostly the corporate greed, not the corporate greed",2024-02-22 21:00:40,3
equity_zuboshi,">they complains about unchecked, unregulated capitalism.

thats even dumber. Unchecked freedom is amazing.

>>They complain about a capitalistic system that allowed profits over people. 

Lol, its the regulations and checks which allow for profits over people. Capitalism maximizes people and minimizes profits. Free markets abhor profit.

In unregulated and unchecked capitalism, profits are hard to come by, all business are small because there are no regulatory monopolies, and the workers keep most of the value in the economy because they make it.

>  
Just my opinion as a leftist bitcoiner.

At least you hit the nail on the head about what is wrong with leftists. They get cause and effect backwards, so they always want more of the cause of their problems.",2024-02-22 22:57:54,2
HumbleBitcoinPleb,"Lol.

When prices rise consistently year after year and never come back to their old prices, this is 100% a monetary phenomenon.

If money supply is fixed, prices would only rise as a result of supply shortages or other economic factors, but they would go back down as soon as those shortages and issues are gone.",2024-02-22 21:53:50,3
bobbytabl3s,No.,2024-02-23 06:28:59,1
DontDieSenpai,"I sincerely appreciate your response. Thank you.

To be quite honest, I have fallen completely in love with bitcoin because of what it stands for. I often shake, and at times, my voice trembles with excitement when I talk about it with others in person. It's only ever really with people I am close to, though there have been some exceptions. 

I can not help but feel a deep, burning passion for it.

I have been working with my current employer (Higher Ed) to help encourage adoption of bitcoin, and it's actually paid off in small ways. Our technology program has a small number of miners now, and they decided to mine bitcoin with them! The professor who led the charge in getting the miners setup actually considered ETH, but we had a chat about it before the miners arrived, and he left a bit more skeptical of ETH than when he arrived. It doesn't happen often (work obviously comes first), but I've had some great talks with the professors in that department, and they're actually located in the same building (which is just AWESOME). While I can't be sure how much of an impact I've had, I hope I've helped contribute in some small way.

I'm trying to do anything I can to help spread the beautiful ideas behind bitcoin. I know not everyone has the same amount of influence or opportunity to do so, but I hope to help encourage others to look for opportunities and take them when they get the chance. Our attempts may or may not succeed, but I don't think that's the point. I truly believe that those of us who have come to realize the power of bitcoin are obligated to share these ideas with others. We absolutely shouldn't spam people, badger, or belittle them; but we should keep our eyes open, listen for the knock of opportunity, and seize the moment if/when it arrives.

I feel like I could go on forever, but for the sake of brevity, I'm gonna just end it here. Thanks so much again for your kind words. Take care.",2024-02-23 01:54:21,2
DontDieSenpai,"For fuck's sake...

I'm out.

This line of reasoning is sooooo toxic I feel like I'm gonna get cancer if I don't leave right now.

We gotta be better than this people.

Peace!",2024-02-22 23:38:22,1
Brusanan,"Yeah, because you don't understand it, it must be made up.",2024-02-23 14:03:59,1
ExternalMonth1964,Im sorry you feel that way.,2024-02-23 03:50:41,5
bobbytabl3s,"You will get your lambo too, just hodl in there.",2024-02-23 06:27:25,3
celestialhopper,"Bitcoin is an unstoppable technology. The white paper, the source code are all free for all to access and learn. There are many people spreading the word about Bitcoin. So... how ready one is to accept the Bitcoin narrative directly affects the price at which one buys Bitcoin. If you were convinced early on by Bitcoin you bought in cheaper. If you believed during the bear market you bought in cheaper. If you were a naysayer or thought Bitcoin died during the cycle lows you missed out. If it's only when Bitcoin pumps that you realise Bitcoin is the shit... you buy in at top. Hence, you buy in at the price you deserve.",2024-02-23 06:22:38,3
HippoLover85,I haven't. If i need to use it again i will look into it! thank you for the tip.,2024-02-22 21:43:56,5
HippoLover85,"My post was more about what the average person thinks about bitcoin rather than what i think about it. And i do think that is the opinion of the average person. for what i think, I'd modify that statement to say, ""Bitcoin is not useful as money because its barrier to use it as such is too prohibitive."" . . . for a variety of reasons . . .

But i don't see anything theoretically wrong with blockchain in general. And in general i do think it is plausible for bitcoin to adapt to become more useful. But I don't see that in its current state. And as someone who had high hopes for bitcoin back in 2013, I don't see it getting appreciably better as a blockchain technology. Although there has been a lot of really good infrastructure and utility built around it. But there are other coins/blockchain tech that are massively better suited as money.

All i see for bitcoin is that it has been used as a vehicle to transfer wealth . . . Not my cup of tea.

I have a couple responses here that maybe useful if you wanted to respond to them.",2024-02-23 00:08:50,1
Swimming-Height9640,I think you guys are forgetting corporate greed. ,2024-02-23 10:25:22,2
FaultyVulcan,Echo chamber does what echo chamber does.,2024-02-23 00:30:49,1
toomanyjackies,"Where did you read that capitalism puts people over profit / minimizes profits? Are you sure you’re talking about capitalism? 

Capitalism
noun
an economic and political system in which a country's trade and industry are controlled by private owners for profit.
""an era of free-market capitalism""",2024-02-23 01:11:50,0
akoster,"This is not correct in the absolute. 

The stock of modern money is a function of the economic productivity.  Regular banks create the stock of money through lending , they lend into a growing asset base driven by GDP growth.   
The rise in prices and wages is a function of the growth in GDP. This is called economic growth.

The median real income of Americans has increased purchasing power since 1970's

&#x200B;

If prices were to contract the economy would contract and everyone would be poorer. Nominal price rises is part of a healthy economy, real increases in Purchasing power are the key factor of economic health. 

&#x200B;

The Money supply ideology was debunked years ago and created by those who were educated during the gold standard. The gold standard was eliminated in the 1970's and these economists did not understand the modern economic model. 

The fixed money supply you advocate leads to economic stagnation. See the 1800-1930's.",2024-02-22 22:42:45,-1
johnfintech,"I missed your reply, only saw it now in my feed.

No worries. Your passion is perceivable, so kudos to you for that. We do indeed have a duty, we being the ones who understand and have the means (some smart men once said ""those who are capable are also responsible"").

That said, especially because you love Bitcoin so much and feel a sense of duty, I would encourage you to also think deeply about its potential problems, in part because you owe it honesty but also because only by being aware and rational can we push Bitcoin to success and avoid sleepwalking into pitfalls -- else we're just another group of fanatics with (potentially big) blindspots which eventually become assailable.

I'm not going to list many of them here, but I encourage thinking beyond the usual (rather shallow and known) issues like energy, mining profitability, tokenomics soundness in the issuance tail, etc. For example, two topics I personally found interesting and have been involved in discussing are (1) the wealth divide danger due to different market entry dates in a pure deflationary bitcoin based economy, which translates to inheritance dynamics that risk creating a potentially bigger wealth divide than fiat and Keynesian economics did; and (2) incentivisation of entrepreneurship in the same kind of economy, contrasting the modern job & entrepreneurship mentality in an economy model that killed savings, to a potential lackluster of incentive for entrepreneurship in an economy model where savings intrinsically appreciate enough to not even need much work or entrepreneurship. And many other more or less profound topics to consider that we might be sleepwalking into without proper consideration. Playing the devil's advocate for the things you love is one of the best ways to really grasp its properties, good and bad, and become capable to do something about both. Experience is the next best way (requires ample time), and also builds authority.

There was a post once on /r/Bitcoin from a person who asked a simple question on the topic of (1) above, which prompted replies of a higher caliber than what you typically see in this cesspool of a sub (sorry). Sadly, it was deleted, but the replies still exist. I saved one of them which I liked (and to which I replied too! I rarely get serious in this sub), which allows you to navigate to the other replies: [https://www.reddit.com/r/Bitcoin/comments/wbez1c/comment/ii7i5y1/](https://www.reddit.com/r/Bitcoin/comments/wbez1c/comment/ii7i5y1/). See the parent comment I replied to, and from there you can navigate to the other replies in the post, some of which are pretty good. You'll be able to infer the original question in the OP.

P.S. I don't know where you live, but while you journey to advocate for Bitcoin, try to protect yourself against potential physical attacks -- there have been plenty of those against crypto folks, as thieves just assume you are loaded, and - despite what this sub says - a hard wallet, or multisig, or etc won't protect you against a knife to the throat or gun to the head. It's better to actually have bitcoin to give away if you get to that point, than to try to protect all your bitcoin, as such attackers are more likely to resort to harm if they don't receive anything, than to leave you be. Just a tip.",2024-02-29 01:53:08,2
equity_zuboshi,"I respect trying to be polite and sticking to soft facts, but calling wildy raving nonsense ""technically correct"" is bit much. Even if you want to be polite, you dont have to cater to insanity.",2024-02-22 23:58:06,3
jerrycatsu,Understand what? I see a generic us vs them opinion full of generalizations.,2024-02-23 14:19:44,1
numvere,"A little sad, but unarguably true. I pity the people yet to be born who will never have the chance to stack generational sats as we stack. But do they *deserve* the price they pay for not being born in time? Yes. Yes they do.",2024-02-23 15:37:38,1
