Author,Text,Date,Score
bbrout,It's possible to buy a house with Bitcoin.,2024-03-06 02:26:07,2
philosophicalpango,Correct-son,2024-03-06 05:15:49,4
Aerion_CA,Poetic,2024-03-06 05:09:01,3
AccomplishedPlum8253,I PUSHED TOO HARD AND I THINK I POOPED,2024-03-06 04:20:55,4
gustavolm82,"it sells at 68-69 because it gets tense waiting for 69.. it's a memory price.. it's as if it was agreed.. if you had a bunch to sell together and wait for the return and buy again.. and sell again .. you would do it too.. I was watching from the beginning and it was a show.. it continues to be.. people following and trying to make money with the pleasure of the huge movement all together in sync.. along with the people who couldn't hold back for sell because they were making losses since the last peak when they bought and are unable to hold on to liquidate the situation they held for a long time. also the people that just got 20-60% on last just days.. and get afraid of correction on new top and sells it for profit.
so its all at once event. perfect.",2024-03-05 16:14:33,3
DogCallCenter,Yr mom's a round number,2024-03-05 20:13:09,4
Silver-Rub-5059,He couldn’t keep getting away with it!,2024-03-05 21:08:45,3
Dont_Waver,$69k to $59k on Coinbase,2024-03-05 20:39:47,4
Background_Floor_118,so frustrating,2024-03-05 20:30:46,4
amazingalcoholic,Break on thru to the all time high,2024-03-06 05:27:55,4
2ManyAccounts24,Mine say we might go up or down,2024-03-06 00:41:05,5
Green-Music2366,You know they're cheap when they start walking sideways!,2024-03-05 10:14:57,3
user_name_checks_out,Huh? Two identical ATHs?  That makes no sense.,2024-03-05 13:45:03,3
Silver-Rub-5059,The corn be with you,2024-03-05 21:07:01,3
monaarts,This.  It just looks huge because there’s no other wall.,2024-03-05 14:36:24,5
Tahmeed09,Can i see otc liquidity anywhere?,2024-03-05 13:24:18,3
91-divoc-eht,"This. Once we breach 70k, price discovery will be wild!!!",2024-03-05 14:38:41,5
StonksPeasant,Glassnode and other places have a list of some of the OTC but its impossible to truely tell.,2024-03-05 14:11:02,3
[deleted],[deleted],2024-02-22 18:01:04,192
HumbleBitcoinPleb,"People dismiss bitcoin because they don't understand it. They don't understand the current monetary system either. They also don't understand supply and demand. Oh, they don't understand free markets either.

They believe inflation come from ""corporate greed"" and other nonsense.",2024-02-22 17:54:38,131
Hasra23,The median person is dumb and half of them are dumber.,2024-02-22 19:49:05,47
DontDieSenpai,"Inflation on it's own is rats' nest; people argue over what it means all the time. Some use it to refer to what I would call actual inflation or monetary debasement and some use CPI. These two groups do not seem to be able to come to an agreement at all, even though they're both technically correct.

Just mentioning inflation as monetary debasement in some subs is a cardinal sin next to murder.

IMO, it's just basic misunderstanding and a lot of that is super basic semantics.

The widest divide is between the Keynesians and the Austrians. Keynesians scoff when you point out how their economic philosophy has effectively eliminated the ability to save. They'll respond that one should invest, and often describe actual saving as ""hoarding"". And they don't see this POV as problematic in any way. They honestly believe monetary debasement is necessary for a healthy economy and many seem to believe nigh infinite money printing isn't going to cause any longterm problems.

Hope this helps, hardly exhaustive, but some quick observations I've made in this space.",2024-02-22 19:23:55,13
Swerve99,easiest way to show BTCs resilience to fiat inflation is show them how many other countries BTC has surpassed ATHs.,2024-02-22 23:44:25,7
Zealousideal_Set_333,"It's bitterness about someone else having got ahead from their BTC investment, while they didn't already have the same success. 

[ECB report](https://www.ecb.europa.eu/press/blog/date/2024/html/ecb.blog20240222\~0929f86e23.en.html) today is fueled by the same bitterness about perceived loss of power.

The ECB perspective isn't entirely incorrect: The ECB correctly identifies that Bitcoin redistributes wealth. However, the ECB's jargon about being at the expense of the less sophisticated just isn't what they think. In fact, by virtue of successfully hodling BTC without falling victim to a scam, you have been sophisticated. 

ECB is bitter that the US has enabled BTC to be an acceptable mainstream investment for financial institutions by approving the BTC ETFs. 

However, unlike for governments, the average individual who isn't already a billionaire would still benefit from supporting BTC wealth redistribution. The people OP mentions aren't recognizing this.

To be honest, I don't believe that in 100 years the entire world will run on a cash-like digital gold currency like BTC. BTC has many flaws that will likely prevent it from ever being the universal world currency -- and I think the people OP mentions have likely correctly identify the flaws in the maxi narrative.  
  
Nevertheless, BTC is popular as a hedge against inflation and a way to protect your money from government intervention. It is what it is. These people are struggling to set their emotions and resentment aside that despite BTC's flaws compared to a perfect digital currency, BTC now has a huge moat as the world's digital gold. 

The ECB is, in fact, the one with no clothes at the moment. The average person would do well to recognize that.",2024-02-22 18:24:09,15
HarmonyFlame,"I was a former progressive democrat and had no resistance at all to learning Bitcoin. I think it comes down to humility. I’m very willing to listen and naturally intellectually curious. So Bitcoin fascinated me from the start personally. 

A lot of progressives are very rigid in their socialist like worldview because like everyone they expected to have the same standard of living from the same work as gens before, however because of their limited economic understanding incorrectly think corporatism is the cause of inflation. Something that is seen as a pure capitalistic instrument such as Bitcoin seems to be the embodiment of everything they hate about the world, at first glance and can’t possibly begin to reason why it could be a solution to at least half of humanity’s current problems. 

They mostly assume their worldview is the correct one and are no longer willing to waver on being anti-capitalism. Doing themselves a huge disservice when it comes to understanding markets like housing or any investment principle.

It’s a shame because this subset of people would benefit greatly from Bitcoin and could supercharge Bitcoin into the zeitgeist.",2024-02-22 19:50:40,15
MidnightStories32,"Earth is full of cognitive dissonance. People cannot see they are at fault for the majority of their problems.

If you were an adult between 2008 and 2022 (in the US) then you have been handed the gift of wealth. If you decided not to accept it, then you’re at fault.

During this time houses were incredibly cheap and quantitative easing made interest rates artificially low. Affordable home ownership was begging you to capitalize on it.

During this time frame you also had the opportunity to buy in at stock values at historic lows, and if you held. You would have made money on just about anything. If you decided not to invest, that was your decision. 

I get there are unfortunate circumstances that may have been unforeseeable. And it’s unfortunate that those limitations impacted a few peoples ability. 

But the majority of America wasted 14 years of opportunity to make a boat load of cash.",2024-02-22 20:08:28,5
Snaggle-Beast,"The same is true of many gamers extreme anti crypto sentiment in general.

Apparently the entire collective of gamers blames crypto for the shitty cost of gpus. Even though mining on gpus has been dead for a year now.",2024-02-22 21:27:08,4
tbkrida,Financial illiteracy and a lifetime of brainwashing…,2024-02-22 23:10:13,4
lostledger,Reddit is pretty commie in general.,2024-02-22 17:53:47,27
Individual2020,"Most western nations are Fascist systems now: corporations, billionaires, and government are one and the same.  Constant revolving door of leadership moving back and forth between the private and public sectors.  So you have people blaming corporations and think government will solve the problem, and people blaming government and think corporations will solve the problem.  The problem is concentrated power and the corruption that comes with it, but both sides never see that.",2024-02-22 19:25:02,13
Hank___Scorpio,"People aren't in any shape to take risk when they're pushed to the brink.

Bitcoin is 100% risk to people who don't understand it. It's speculative gambling to the uninitiated and from their perspective its just a hail marry, lottery level Yolo to fix their position.

Primacy bias is a mother fucker. It's so difficult to overcome. Everything you hear about bitcoin usually has to be viewed through the lens or your primary bias.

Believing bitcoin is a scam, ponzi.... whatever frees people from having to take it seriously. It frees people from having to take risk. It frees people from having to learn.

Everything about bitcoin is anathema to the way humans learn. We move towards pleasure and away from pain. Bitcoin forces us to go against that while trying to unlearn what we know and  take on risk and often pain. Everything is working against the individual when thinking about bitcoin.",2024-02-22 19:29:33,3
2008Phils,I’m guessing they are in debt and can’t buy bitcoin even if they wanted to. They’re just frustrated. Period.,2024-02-22 19:31:58,3
DeviljhoFood,"Perhaps it is selection bias. People who understand Bitcoin might be less likely to hang out in other financial subs. That would concentrate even more people who **don't** understand Bitcoin in those subs, thereby making Bitcoiners even less likely to hang out there, and so on, and so forth.

I'm just making this up. I have no idea.",2024-02-22 19:55:20,3
Normal-Jelly607,Stockholm syndrome,2024-02-22 20:16:29,3
InvestIntrest,"The people in those threads usually struggle to understand or morally hate the concept of your money, making you money. They're usually broke and frustrated for a reason.",2024-02-22 20:36:20,3
Robin_Ape_Williams,"Some people just can't wrap their heads around it

I love this clip of the [Winklevoss Twins explaining Bitcoin to Dave Portnoy (of Barstool Sports)](https://x.com/stoolpresidente/status/1293966853652516865?s=20)

They soundly explain Bitcoin, and why it's a better store of value than gold. But Portnoy gets caught up in the hypothetical scenario that Musk is going to mine gold on Asteroids and calls it all sci-fi rather than accept the underlying fundamentals,",2024-02-22 20:56:25,3
uhhh-000,"People CAN read a fucking book, but MOST absolutely refuse to educate themselves beyond what is mandatory. Most people lack the wherewithal to learn about investing... much less actually do it. Most people live only in this day and do not think much about tomorrow",2024-02-22 22:14:56,3
looster2018,"Keep your eye on your business and don't worry about a world full of non-believers and negativity. 

  
“You will never reach your destination if you stop and throw stones at every dog that barks.”  
― Winston S. Churchill",2024-02-22 22:18:30,3
Intelligent_Box2320,"Most people misunderstand BTC (even a sizable % of Bitcoiners). 

It's more of a long term, inflation-beating store of value than anything else...it's WAY too early to view it as an alternative ""currency"".

Bitcoin will continue to have it's place as a wonderful alternative asset class for decades to come (the ETFs really allow it to become part of mainstream investment portfolios), but it's nowhere near an easy-to-use currency for most humans.

I would also say that it's far better for the Bitcoin community to talk about it more as an transformative investment asset class rather than a digital currency attempting to replace fiat.  No need to piss off and/or scare government regulators when it's completely unnecessary.",2024-02-22 22:39:58,3
Cormyster12,"I don't think it's that they prefer dollars, they don't understand them either",2024-02-22 22:43:49,3
ether_slonker,"Socialists aren’t motivated by actual bettering their fellow man, but hating the rich. They’ll eventually be bitcoiners’ greatest opponents.",2024-02-22 20:19:45,6
CheebaMyBeava,bitcoin was designed for what now?,2024-02-22 19:02:11,4
willfifa,"Ideally people wouldn't have to invest in highly volatile assets to be able to buy a home, start a family etc 

If people are buying this year without understanding Bitcoin they'll probably get wiped out, especially when they buy the mania phase",2024-02-22 20:12:27,2
ualdayan,"Have you ever been out and seen an animal caught up in something, you just want to help and free it, but the moment you come near it starts snarling and trying to bite you?  Humans still share a lot of the base instincts that every other living thing on this planet has, some call it the 'lizard brain'.  If we're caught or stuck somewhere by something physical our brains can understand that somebody else might be there to help us get free - to cut whatever is wrapped around us, but if the topic in mind is something that the average person has little to no understanding of (fractional reserve system, central banking, inflationary pressures, deflationary pressures), they revert back to instinct.  That instinct being to strike out - assume those that are trying to help are 'out to get you'.",2024-02-22 20:19:57,2
DackNBills878,"People who can barely save any meaningful amount of money usually will not be inclined to acquire bitcoin. They live life on a day to day basis and have a hard time thinking years (even months) ahead.  
edit: fixed brackets typo",2024-02-22 20:20:28,2
ZenOfFool,"Ignorance is easy.  Also maybe they like their misery, some people like to complain without taking any action.  Easier to blame others than yourself.  We stack and we possibly have a chance of making it.  I'd rather die trying than never, it's either WAGMI or HFSP.",2024-02-22 20:20:44,2
20k_dollar_lunchbox,"People dont want a solution, they want to complain about a problem.",2024-02-22 21:22:56,2
GiverTakerMaker,"People falsely correlate bicoin NGO with fiat becoming worthless. They are easily convinced by FUD that suggests BTC is the cause of Fiat debasement.

It is much harder to come to grips with the realisation that the government and media have been egregiously lying about everything for decades than to blame a new technology you dont understand.",2024-02-22 21:48:59,2
Disastrous-Dinner966,"The people most vocally frustrated about how much easier it was for previous generations to build a life are the same people that think it's progress for women to be in the workforce competing for jobs with men. You see, when you double the size of the workforce by adding women into it, wages and benefits for everyone get cut in half. Nobody wants to acknowledge the simple economics because it's rather politically incorrect. It's so funny to see how men like Rockefeller are lauded for their early commitment to women's liberation, when all he wanted to do was screw his employees over for bigger profits. God, did it work like a charm or what? I mean, everyone used to have a pension and even Homer Simpson could be a humorous buffoon on TV with a house, wife, and three kids, vacations, and two cars and all on his working class salary. That was what life used to be like. It's all changed now, maybe for the better, or maybe for the worse, I can't say for sure. All I know is that if you're going to identify the problem, let's identify the real causes.",2024-02-22 22:03:51,2
Pretend-Hippo-8659,"Sunk cost fallacy. They are so invested in the fiat system as it was all they ever knew, it is hard to make a 180 degree turn now and go full Bitcoin. So they will whine about it but stubbornly push forth.

And then there are commies who just like to whine about everyone who’s better off than them through hard work. They want those people taxed highly, preferably 90% because “it is all so unfair”.",2024-02-22 22:12:02,2
Grouchy-Ad981,"Seems the older we get, the more we fear the new. No surprises there. I was a slow adopter, hearing about it late 2012/13 and not buying my first position until 2020 when the blindfold was lifted for me. Hopefully the wave continues!",2024-02-23 00:19:38,2
Accurate_Sir625,"In the back of their mind, they have this nagging suspicion that they too should be buying Bitcoin. But, they don't understand it and so it's better for them if if fails. Then they don't feel so bad on missing out.",2024-02-23 00:54:02,2
Tofushopdriftin,"Some of us just don't get it, or we're so conditioned we can't actually challenge the system even if we're well versed in it's flaws. Some of us who are learning about investments or crypto would totally buy ""back when it was affordable, it's only for the rich now.""

I'm *very* new here. I've been trying to keep my head down, learn as much as possible and I've been hesitant to comment because I don't want to bring any attention to the fact that that I hold *any* btc. But the second I started to understand the potential of what bitcoin is, I immediately started putting all my side money into this. It took a lot of critical, independent thinking to realize any point is a good point to start. I didn't feel the need to ask if small buys were a good idea, I recognized bitcoin potential applies to everyone at different levels, what you can afford has the potential to benefit *your* life greatly.

I stand by the sentiment ""everyone deserves bitcoin at the price they buy at."" At one point in time I may have taken that as a slight, and maybe it's intended to be. But it's also a very mature way of looking initially getting started. The writings been on the wall for a long time. Both in regards to btc's continued success and all of bearing witness and *feeling* the dollar inflating. Dca-ing, trading in shit coins (if you can, and they aren't locked behind judicial action), whatever strategy you feel called to: immediately becomes a priority if you 'get it' on any level.

We're witnessing truly remarkable shit. I've learned across the board in many different aspects of life, it can take folks a really long time to validate anything that inherently pokes holes at structures they depend on. Even ""in your face without a doubt remarkable shit,"" but contradicts the status quo or the powers that be. Bitcoin does that in a huge way and I think unfortunately many folks will continue to hit the hurdles of thinking it's a scam, until realizing it's not but feeling intimidated by the (face melting?) price points btc will be at when they come around. Then again maybe over time folks will understand it better by the time they're jumping in.

Apologies if this is a rant but I'm happy to be here and I've learned a fuck ton from all you folks in a rather short period. Thanks 🤙🏾",2024-02-23 02:41:37,2
PresentationCivil877,"If they knew it's not the big corporations, and it's govt spending by the tards they voted in, well fuck em. You can't fix stupid, if they believe shrinkflation is snack companies faults or hig gas proves is because gas stations are greedy, well perhaps I don't mind seeing them die destitute for allowing this shit to happen, the person explaining shrinkdickflation is the person to put in the noose for it, not the snack makers who either have to A: sell you less product to keep the same price point, Or B: charge more for the same shit and sizes because they as a company can't keep up with govt debasement and world de-dollarization, or inflation in short. 

But this is just the chocolate on the ice cream cone tip and well..... that's not chocolate either. Truth is weve not seen anything just yet. I have 100 trillion dollar bills from Zimbabwe it's like 3 dollars us. But soon that might Trump the US dollar. 

Bitcoin gold silver food water ammo",2024-02-23 03:22:58,2
[deleted],"A less ""opinionated"" answer is that sometimes, the people you're talking to aren't looking for solutions. They're venting, ranting, upset and trying to vocalize how they feel.

To many readers, there has been a time in your own life where you simply wanted someone to listen. While yes, providing solutions to your life issues will eventually be required, there's a time & place for everything. Sometimes, people just need to vent. And, if you interrupt that process even in good faith, then they'll feel like you aren't listening to them.

It's not to say there aren't people who are religiously hateful of BTC for little reason besides tribalism, but if you go door-to-door like a window salesman saying ""Just buy BTC"" whenever people are concerned with inflation, you will garner the same negativity that windows salesmen have.",2024-02-23 04:24:12,2
Kie_ra,"People don't understand money.

Look at how many morons are out there thinking just because they were able to buy something for $20 in the 90s, it also means they should be able to buy it today for $20. Then they complain how everything is so expensive and unfair... morons.",2024-02-23 08:19:59,2
mckenzie_keith,"Easy. They think bitcoin is a grift. They think scam artists invented it and promote it and suckers buy it while the scam artists get rich and cash out. This is what they think all cryptocurrencies are like.

A lot of people also hate it because they think proof of work wastes energy and increases global warning for no good reason. I am not sure how this correlates with frustration over inflation. But it is just another reason why some people are dismissive of bitcoin.",2024-02-23 09:04:26,2
caesarinho21,"Situation with Bitcoin in Serbia is also pretty damn terrible. We have small ""dvadesetjedan21"" community for ex-Yugoslav countries but TBH people in Serbia despise Bitcoin for some reason and I regularly get blocked on X and expelled from forums and Serbian Reddit subs when trying to explain people that they are simply wrong (and we had hyperinflation in 1990s). In real life as well, I constantly get mocked so over time I decided to become quiet and just stack sats lol.  
And of course to get much more engaged among my fellow Bitcoiners - it is much healthier this way and the final outcome for Bitcoin is going to be the same nevertheless (although some fellow Bitcoiners accuse me for being ""too extreme and senseless"").  
Bitcoin doesn't care, stay humble and stack sats!",2024-02-23 15:45:40,2
SilverBeneficial7333,They hate it because the mainstream hates it. Most people are sheep.,2024-02-23 18:23:17,2
SilverBeneficial7333,"People dismiss it because they don't understand it and they think it's a traditional technology just like the iPhone. So they look around and see that it's not being used to purchase coffee and they're like ""What the fuck is the point of this thing?"" without realizing that it's a brand new financial infrastructure. The same people that don't understand Bitcoin probably don't know what FedWire is or the Bank of International Settlements etc. I usually like to ask people who are skeptical of Bitcoin how new money is created into the economy. It blows their mind that its through lending.",2024-02-23 18:26:42,2
Present_Air_7694,"\> Especially during the anti-billionaire/an discussions

I'm just amused at you implying that anyone would be pro-oligarchs...",2024-02-22 18:02:30,4
daemonpenguin,"A few things:  

> which was designed specifically to combat the machine they are raging against.

Except it isn't. Bitcoin doesn't do anything to change the distribution of wealth. Most of BTC held today is held by institutions and millionaires. It does nothing to help people who can't afford to buy a home.

Also, people who can't afford cars and homes usually can't afford to invest in assets like Bitcoin.

Also, most people who are struggling to invest are going to have trouble with the idea of investing in a completely virtual asset that sounds like a scam when they're used to investing in things like companies and physical goods.

In short: you're in an echo chamber wondering why not everyone believes the same things you do instead of taking time to learn why they believe the things they do.",2024-02-22 17:46:37,4
rebeldogman2,Because they just want “the rich” to pay for them to have housing medical care and food. They don’t want to get rich or to work for it. They just want it. They think if we just tax the rich they will have everything for free but that there will always still be rich people for them to tax so they don’t have to work. But the rich would just move to another country or hire lawyers to shield their wealth if that happened.,2024-02-22 20:49:09,1
